aut,929,"Nobis aut amet et id porro repudiandae. Unde sit quos architecto aspernatur et. Enim dolore doloremque rerum molestias aut consequuntur impedit. Omnis et at perferendis soluta rerum. Tempore earum sed accusantium non consequuntur similique accusantium id. Aliquam eos ea totam vel dolores. Sit ex debitis non quis. Autem veniam qui magni neque in. Ratione totam voluptatem provident molestias. Possimus itaque eos quos mollitia dolorum iure ut. Ipsa incidunt et occaecati est. Voluptate rerum recusandae error sit officia dolor. Qui omnis voluptas voluptates iure et facere. Corporis voluptates repudiandae quia inventore. Repellat enim qui necessitatibus enim. Quia quod consequatur adipisci veniam natus iste soluta. Est blanditiis enim rerum vero repudiandae sint officia. Vel aliquam consequatur enim esse et corrupti. In molestias id et omnis autem. In rerum fugiat expedita cum in. Illo et nam eum sunt eaque ratione asperiores. Nihil non et occaecati provident nobis laborum ad.",4.52856,id,4,670,2002-11-24
molestiae,3771,"Sed quo aut ut aliquid sunt laboriosam fuga. Qui consequatur id at consequatur mollitia repudiandae molestiae molestiae. Adipisci quas quia fuga qui eos ullam qui et. Sunt iure qui impedit molestiae repellendus nihil. Ea at illum assumenda veniam laborum est. Culpa aut incidunt aliquid minus illo necessitatibus cum. Debitis molestias porro aut dolores culpa sit delectus enim. Amet sint consequatur id voluptatem non occaecati omnis molestiae. Cumque aliquid nemo dolorem ipsam. Nisi voluptatem suscipit nostrum sed delectus ipsa perferendis et. Est doloribus totam qui ducimus magnam. Et magnam quo incidunt. Reprehenderit ducimus dolor nobis sed fugit. Officia quia dolores voluptatem eum ut molestias ut praesentium. Voluptatum quia sapiente libero dolore ea tempore id. Rerum quo sed ut officiis ea quo quam. Quia accusantium beatae voluptatem omnis. Architecto nesciunt est veniam omnis occaecati molestiae. Quaerat voluptate harum ut nihil amet temporibus.",86648.5451408,nulla,20,829,1992-06-14
consequatur,4013,"Mollitia voluptatem vero porro quia nisi. Vitae dolorum commodi veritatis. Rerum eius ut libero. Et aut sapiente in error ab tempora. Ut consequuntur odio rerum autem incidunt omnis veritatis non. Qui a aut debitis quia. Ducimus corporis quasi aut quidem. Ducimus velit ut nihil. Eum illum sit tempore enim cum est laboriosam. Voluptas eligendi exercitationem eaque nobis saepe rerum. Debitis ipsa quas sunt ut enim repudiandae. Maxime eius sed ut quis minus. Autem animi dignissimos aut assumenda atque quae sit exercitationem. Inventore sit doloremque et eum eligendi iusto. Ut blanditiis est quis non et ipsum. Exercitationem occaecati eveniet accusantium aperiam et recusandae voluptatum perspiciatis. Dicta voluptate temporibus nulla delectus. Ex adipisci sed sed consequatur. Quia odio debitis rerum consequuntur amet. In ab ut facilis eveniet. Beatae architecto voluptatibus quidem blanditiis dolorem possimus nisi. Inventore at ab quis velit error cum.",83.63305,ab,2,783,1972-10-04
quaerat,137,"Omnis at iusto alias eos. Omnis perspiciatis perferendis quod voluptatum libero. Aperiam quaerat consequatur sint molestiae est totam. Rerum architecto minima et voluptatem autem. Suscipit et ea recusandae qui cumque sit. Voluptatem possimus mollitia sequi eaque eveniet sit. Quod quod est non quisquam id qui culpa et. Asperiores doloribus quaerat voluptatem est numquam. Sed officia quidem officia debitis consequuntur odio rerum sunt. Quis animi doloremque atque molestiae distinctio sit. Dolores velit voluptates iusto molestiae asperiores fugit consequatur. Libero nihil dignissimos suscipit expedita. Ab optio facilis accusamus praesentium beatae voluptates. Minus qui totam cumque rerum assumenda. Illum nihil ut corporis quia qui at. Qui quibusdam est adipisci ducimus. Enim atque quae magni laudantium vel. Asperiores maxime ea laborum voluptatum temporibus qui a. Fuga eaque perspiciatis mollitia aliquam harum et. Dignissimos in saepe assumenda officiis nisi cupiditate perferendis.",425.2,accusamus,1,561,1998-03-19
doloremque,1862,"Ad maiores quis dolor quo. Omnis voluptas esse incidunt facere consequatur. Est dolorem porro in necessitatibus modi sed cumque. Ullam maiores non amet qui eos quae ad. Provident qui corrupti aspernatur consequatur magnam. Facilis voluptatibus et omnis commodi. Maxime id aut adipisci qui accusamus voluptatibus et. Asperiores architecto aut minus velit. Voluptates nesciunt quidem perspiciatis aut qui recusandae. Mollitia blanditiis corporis ex dolore eveniet ullam. Minus perspiciatis libero est. Animi voluptate possimus accusantium ut officiis ab hic. Ut fuga iste ut. Consequatur delectus aut harum sunt nisi assumenda. Occaecati accusamus qui sint temporibus voluptas neque in asperiores. Rerum sit impedit aut nihil vel voluptas. Et corrupti nam rerum officia esse occaecati id. Quos repudiandae molestias illo ut nemo soluta recusandae. Consequatur vel quia fugit fuga earum nam nihil. Eveniet hic omnis error voluptas.",9189.2942251,aperiam,13,948,1977-12-01
neque,951,"Corrupti cumque facilis quia asperiores. Est consequatur amet autem. Dignissimos accusantium saepe voluptatem eos. Libero delectus qui adipisci non. Voluptatem incidunt enim voluptate autem aut vero sequi impedit. Ea qui nulla illo quia. Tempora explicabo adipisci rerum sint quidem autem aspernatur consectetur. Eos eaque cupiditate ut in. Dolor ex eos quaerat nulla aut animi at. Est non quia quia eligendi doloribus porro. Excepturi suscipit ratione tempora explicabo quibusdam sit. Iste rerum eum sint possimus eos. Omnis et officia ut. Saepe vel cum repellendus corrupti. Et ea quis qui. Optio aspernatur eligendi voluptas officiis earum molestiae officia. Qui beatae atque ut veritatis quis maiores nihil. Omnis enim ea voluptas enim. Explicabo quo adipisci culpa. Laborum eum eius earum laudantium quod quia. Consequatur laboriosam dolores dolores adipisci nulla aut et minima. Perferendis illo quia esse dolores similique repellat ratione.",20527.33,laudantium,25,961,1978-10-27
sapiente,2990,"Quasi rerum doloribus eos non distinctio vero voluptas. Officia libero qui sunt sequi. Vel nam accusantium voluptas vel. Autem aut omnis culpa quae nulla ea illum. Laudantium earum quo sunt ab magni sapiente quo et. Vitae provident commodi voluptatem qui maxime ipsam totam. Sint veritatis aliquam eaque ipsa. Ut voluptatem blanditiis rerum sunt ut vel. Explicabo et laudantium quos velit similique repellendus non. Nobis vitae omnis quaerat optio sit. Ut et quia molestiae nam vel. Quae aut numquam incidunt quo. Et quam debitis unde culpa numquam culpa a. Facilis deserunt omnis quis et similique et. Culpa consequatur iure ut. Impedit quas et sed tempora quia. Est ut odit ad nihil. Impedit voluptas debitis omnis in culpa reiciendis dolores. Ex excepturi vel in et repellendus ut. Magnam deserunt quidem et voluptatum aliquam. Cupiditate non hic tenetur expedita accusantium dolor. Ratione consequuntur blanditiis ipsum vitae et in ab.",573509140.40941,fugit,25,454,1978-12-12
omnis,4986,"Ratione voluptates ipsa magni tempora praesentium veritatis ut. Adipisci eaque aut dignissimos pariatur omnis exercitationem suscipit. Eos ut qui quasi. Non et rerum dignissimos sint est dolorum itaque. Ut vel porro sequi quibusdam et. Vitae non qui eos illum cupiditate. Aut dolores rem et eveniet itaque vitae. Aut porro veritatis natus atque. Repellendus porro ut non iusto sed possimus nisi. In ipsam sint rerum autem. Dolorem in ut suscipit laborum sit in recusandae magni. Officia porro delectus ullam ut harum. Nam inventore eum et. Dolorem magni sit corporis. Et amet delectus vero sequi quas dolores et. Consequatur beatae esse voluptatum. Rem enim quis iste quaerat sunt. Porro voluptates dolor veritatis reiciendis et officiis. Culpa excepturi suscipit eos iusto ea neque non non. Rerum accusamus beatae necessitatibus illum dolores temporibus. Officiis dolores optio nihil omnis aut. Omnis voluptates quod beatae itaque et dolore.",32.2105763,odio,2,577,2017-07-23
voluptas,2173,"Architecto iure reprehenderit debitis molestiae non. Eos sed ut et aut et. Recusandae sint voluptatem optio a voluptas. Blanditiis sed ab et quisquam commodi. Quidem velit eaque ut quidem iusto saepe vel. Iure error quo mollitia maxime. Non et nulla facere cum voluptate corporis omnis. Recusandae neque libero et nam. Ipsa doloremque vel quos dignissimos illum impedit. Adipisci dolorum debitis aliquam qui qui ad repudiandae. Aut aspernatur aliquam in. Voluptatibus culpa maxime aut repellat rem natus. Ut molestiae veniam tenetur ipsa beatae quod. Vel facere et quos eveniet distinctio perferendis soluta repellat. Odit dolore eligendi dolor eos molestiae perspiciatis reiciendis. Velit ut aut eos nihil aut asperiores. Alias autem molestiae nobis in ratione repellendus aut. Ut ut ad eos ipsum sed rerum. Voluptatem minima hic quibusdam voluptatem ullam nihil. Id eos qui aliquam non quam nobis omnis.",532392978.52801,aut,3,387,2005-05-08
mollitia,4326,"Deleniti repellendus ea itaque sint vel. Similique sequi odit ut repellat harum sequi. Itaque in et consequatur. Distinctio adipisci fugit deleniti quis et provident aut ut. Nam eaque in adipisci adipisci omnis quisquam. Modi quos omnis numquam ratione. Et iusto dolores laboriosam. Et esse illo non sed nostrum itaque nobis necessitatibus. Porro est quis voluptas quae laudantium. Rerum laboriosam consequatur sit. Sequi eveniet dolor voluptatem accusamus. Consequuntur qui accusantium consequatur qui dolorum vel repellat. Voluptate in provident et qui nostrum neque. Vel sit error sit quia consequatur dicta aut. Quae ut animi numquam fugiat quaerat cumque et provident. Consequatur excepturi eaque et et sapiente. Non molestias sit vel voluptate consequatur voluptatem autem suscipit. Ex veniam eum et perferendis veritatis. Error ut blanditiis vel quae.",0.6262043,vero,20,732,1971-05-15
qui,639,"Sit et voluptatum aspernatur illum id velit. Quia aperiam assumenda delectus assumenda incidunt. Dolorem qui minus tempore non autem similique nostrum aut. Quo ut ea iusto quo dolorem autem. Dolores dolorem omnis vitae quae mollitia aut. Dolorum id omnis harum est excepturi voluptates. Dolores error quis quia. Aut magni enim eaque. Expedita voluptatem sit enim quo libero consequatur sit magnam. Eos voluptas enim voluptatibus adipisci velit natus laborum. Nemo et nostrum cupiditate et. Consequatur modi omnis unde rem aperiam quidem excepturi aliquid. Repudiandae nemo rerum assumenda in. Qui est minima qui. Dolorem laborum et est eaque. Voluptate ut explicabo suscipit voluptatem. Laudantium est dolorum sit rerum qui dolore. Est saepe ut cum et quas numquam eos. Fugit et optio ut inventore. Necessitatibus quo nihil qui saepe vel. Nesciunt cum deserunt officiis molestias amet nobis. Dignissimos saepe voluptatem iste quia. Maxime ut ex et quas.",270689162.44609,quasi,7,575,1984-06-30
dolorem,4074,"Ad eum aut enim voluptatibus maiores libero tempora. Voluptatum qui aliquam doloremque suscipit non consequatur totam minima. Aliquid ut ut nesciunt eaque quis eum quaerat. Vitae aperiam reprehenderit qui reiciendis vero eum. Voluptas possimus deleniti id et nobis. Nulla voluptatum eos rerum numquam placeat impedit nobis. Natus libero illum molestias iste error ipsa distinctio porro. Ex ad accusantium necessitatibus est fugiat molestias sit. Et deleniti dolor ipsum quidem est. Rerum id qui vel exercitationem sapiente inventore quia. Illo sit aut harum animi cum dolor. Voluptatem sunt dolor consectetur unde ipsam et. Illo et sed iure. Ut rerum ut voluptatem odio explicabo officiis suscipit. Quas commodi et itaque officia ea dignissimos sed aliquid. Culpa nam incidunt et alias molestiae. Occaecati nisi consequuntur iure dolor rerum ducimus nobis esse. Et esse dolorum dolores quaerat sunt.",49761644.520991,cum,17,426,1999-10-30
iste,1992,"Nulla est omnis incidunt nam perferendis maxime. Est quasi est quae non eum. Minus voluptas illum id aliquid velit. Illo id quo ad repellat. Unde aut repellendus at placeat qui. Distinctio suscipit praesentium molestiae dolor. Vel saepe illo eaque consequatur. Laudantium aliquam modi eos totam. Unde unde assumenda earum enim ut reiciendis delectus. Numquam vel voluptatem atque alias et. Voluptatem quisquam iste nam voluptatem distinctio assumenda ea. Quis ea est neque corrupti. Saepe reiciendis magni reprehenderit doloribus dolores eveniet id. Ea in fugiat neque aut asperiores molestiae. Incidunt possimus et qui. Voluptatem qui ratione ut vitae. Rerum aut nihil aperiam tempora. Aperiam est eos sit dolorem reiciendis. Qui odit architecto reprehenderit non aut quaerat. Et qui quibusdam natus labore. Qui dolores illo sint sunt et.",208723.7414,et,14,98,1983-09-05
quae,1147,"Ut qui est laudantium possimus. Qui facere asperiores quis. Distinctio sed eius accusamus molestiae. Incidunt voluptas sunt nihil alias. Quia qui non voluptate reiciendis in odio quia. Beatae pariatur et eaque excepturi est cupiditate. Tenetur rerum voluptatem corporis iste. Accusamus ipsa reiciendis exercitationem qui alias nobis. Nihil et nemo doloribus voluptates vitae exercitationem. Corporis beatae dolor et eaque. Ipsum quo nostrum in odit esse eius ut. Commodi tempora doloremque quibusdam quidem eum quia. Qui corporis corporis et et earum. Quae deleniti eos a. Ex sit rem delectus eum non culpa ratione voluptatem. Molestiae et vel consequatur minus quia. Consequatur nam doloribus deserunt enim. Omnis tenetur itaque nemo eveniet rerum. Vel culpa iste qui hic. Ab qui blanditiis non ratione quos commodi accusamus. Expedita hic odit voluptatibus nostrum minima placeat cumque et. Aliquam nostrum labore eligendi. Facere dolore ab sapiente.",878.928,excepturi,17,959,1993-05-31
recusandae,2645,"Provident libero officiis vel voluptatem. Dolores repellat dolore commodi est illum cum. Aut et amet ut enim saepe repellat qui repellendus. Doloribus rem nisi quaerat similique veritatis. Quia aliquid qui facilis quis deleniti. Dicta incidunt harum rerum vero et. Doloribus voluptatibus aut excepturi. Repudiandae minima qui voluptatem ducimus occaecati velit. Qui enim placeat et. Aliquam et tenetur sunt cumque qui alias. Ad incidunt rerum illum impedit. Distinctio quidem soluta esse quasi vitae. Odit fugiat voluptate sed fugit expedita atque. Vel laboriosam sunt reprehenderit ut necessitatibus quae minus. Dolores dolor laboriosam est sit. Provident aut est numquam amet sit. Illo dolorem nihil eaque laudantium neque. Id quo beatae amet dolores non illo dicta. Beatae laudantium perferendis vel et animi eius. Qui accusamus fuga aperiam ad inventore quas. Fuga sed eveniet eius. Nulla ducimus non voluptatum sed quo occaecati.",110334347.04,id,7,771,2007-11-20
in,2493,"Unde magni voluptatibus temporibus facilis consequuntur. Doloremque non laudantium delectus quia. Ipsam dolorem non possimus quo. Aliquam saepe et dolor ratione. Omnis dolorem vitae omnis. Non hic qui facere itaque molestiae. Non consectetur sint et cumque velit neque dolorem dolorem. Aut facilis magni incidunt ut quaerat ut vitae. Est distinctio et et. Sequi impedit suscipit ex. Adipisci voluptatum vel blanditiis. Sunt quaerat neque qui architecto corporis. Reprehenderit tenetur quos quas beatae quis consectetur voluptas. Qui velit quae est possimus veritatis ea. Provident praesentium quis repellat delectus. Et illo temporibus eos officiis voluptas. Sit quidem rerum rerum suscipit quidem. Ut excepturi ad et voluptas reprehenderit mollitia. Omnis ratione facere itaque numquam voluptates possimus sunt. Id pariatur dolores et qui sit sit aliquam explicabo. Rerum est perspiciatis voluptatem ea qui quisquam fugiat ipsam.",84.8,autem,9,551,2005-03-09
neque,276,"Illum debitis impedit aut adipisci. Aspernatur nesciunt ea quia repudiandae fugiat unde libero. Facere consequuntur perferendis ducimus non. Veritatis officiis id commodi incidunt voluptas iste consectetur. Qui temporibus atque ducimus aut amet reprehenderit. Incidunt cupiditate id aut possimus minus quaerat. Quia repudiandae est ea aliquam eaque sint sunt. Voluptate dolores et nostrum rerum. Harum corrupti nihil explicabo perspiciatis animi cum fugit. Quisquam rerum aspernatur fuga cumque repudiandae sint maiores sed. Voluptatem tempora assumenda iusto quia inventore aspernatur. Quisquam laboriosam et repellendus esse. Sit rerum natus ut. Deleniti ea velit aut cumque. Necessitatibus fugiat labore est ea tenetur. Alias aperiam sunt dolores et maiores omnis praesentium. Et nesciunt nobis vel. Nostrum exercitationem mollitia a optio quisquam. Dignissimos aut id consequatur inventore odit est. In iure consequatur autem optio.",1838366.8373,quidem,23,561,1981-08-19
blanditiis,3973,"Assumenda sed itaque exercitationem nesciunt dolores est. Quia qui eveniet odio dignissimos explicabo est. Ea assumenda ullam est laboriosam sint occaecati. Quis repellendus aut et molestiae officia eum. Repellat omnis sit possimus. Eius ullam facilis magnam et accusamus odit nihil. Assumenda quia commodi tempore dolorem sunt. Deserunt dolor omnis quidem et eaque et. Nulla consequatur omnis commodi officiis quia eum repudiandae quam. Perspiciatis aliquid ut perspiciatis sapiente qui magnam maxime. Est inventore aut illo fugiat quia delectus molestias occaecati. Similique est doloribus officiis asperiores. Quisquam deleniti reprehenderit qui ea numquam veniam. Reprehenderit ipsum sit non ipsam quos dolorem sed. Sunt beatae est harum dolorum ut ad omnis. Illum aut exercitationem quam aut. Voluptatibus est autem error in sequi quod. Ut vel provident eligendi fugiat maxime recusandae voluptates.",0,deleniti,14,271,1983-06-18
aliquam,1839,"Ullam nulla et maxime expedita sed et. Aut similique distinctio in repellat quo repudiandae. Veniam dolores ducimus et fuga non. Et porro deserunt et est iste molestiae reprehenderit aut. Consequatur molestiae facere natus beatae. Doloremque et cumque nam dolores facilis. Expedita et repellendus quos. Vel dicta ea ad mollitia voluptas. Nesciunt omnis occaecati blanditiis omnis quisquam dicta. Est mollitia natus dolorem omnis. Aliquam consequatur libero adipisci ratione. Libero accusamus soluta officia occaecati. Ea sit fugiat non delectus et aperiam. Ut in inventore est aspernatur. Sint a totam quia rerum explicabo. Cumque modi dolores est. Voluptatem voluptatem aspernatur rerum qui. Sint et saepe suscipit ex. Non sunt nemo natus dolores et nisi reprehenderit. Et dolorem porro odit vitae debitis laboriosam. Accusamus quisquam quia molestiae quis officia illo cupiditate. Reiciendis voluptate accusantium doloribus. Quidem inventore sit rerum excepturi ut ducimus repellat et.",2.208,aut,20,544,1970-06-19
rem,970,"Dolorem molestiae magnam repellat labore. Non totam corporis quia dolorem id et voluptatum. Delectus rerum culpa velit asperiores voluptas animi aspernatur. Voluptatem eum similique ipsa dolor. Ut voluptas facere dolor. Quasi minima cupiditate sit quia omnis odio. Eligendi delectus id praesentium perferendis necessitatibus voluptatem laborum. Vitae perferendis ea consequatur omnis eos beatae. Aliquam unde quis ullam nobis numquam quod modi. Recusandae ea ipsa repudiandae nesciunt amet accusantium architecto. Ut occaecati dolore quam voluptas. Soluta perferendis maiores quis et maiores illo. Error et nemo qui similique necessitatibus sit. Cumque voluptatum aspernatur consectetur sit sit voluptatum et expedita. Sint eligendi maiores consequatur accusantium et. Dolor omnis eaque et minima consequuntur ipsam. Aut vitae deleniti hic et amet tempora accusamus. Ut vel ad voluptas tempore et. Consequatur et unde consequatur sed magnam nobis.",349.2692,quia,30,110,1983-09-14
reprehenderit,1678,"Velit nam fugit corporis fuga odit voluptatum. Reiciendis suscipit qui nulla dolores dicta. Nemo aut dolor dolorum temporibus. Corporis voluptas dolore illo repellat autem voluptatum. Dolorem est quo culpa corporis. Sed non id neque ullam. Qui alias in eum sed ut esse molestiae voluptatem. Maxime maiores officiis facilis ab. Ratione similique perferendis quae. Quisquam placeat facilis voluptatem occaecati quis laborum. Dolorem quia nisi consequuntur omnis distinctio vitae. Dignissimos quasi et suscipit provident. Temporibus quae laboriosam ipsa sunt nihil deleniti soluta accusantium. Voluptatibus iste vel distinctio excepturi id et accusamus. Saepe a corrupti dignissimos perspiciatis quos vel. Ratione quo voluptatem temporibus quo numquam ad soluta. Ea aliquid rerum praesentium est ea. Sint repellendus quibusdam architecto ullam doloribus optio veritatis. Inventore quo cumque et impedit quia. Placeat et minima qui eum et deserunt vero.",17909.399,eligendi,1,986,1989-05-31
atque,2335,"Distinctio molestiae qui atque exercitationem. Non totam exercitationem nemo praesentium et deleniti rerum. Eaque cum dolores dolorem et est. Accusamus optio assumenda voluptatem. Recusandae sed enim voluptatem. Ut tempore non velit officiis blanditiis voluptatem. Quos ducimus suscipit maiores voluptate ipsam dolorem inventore. Asperiores eveniet corrupti quos rerum nemo aut in. Temporibus qui modi consequatur sint ut. Culpa enim occaecati et et. Necessitatibus unde natus corporis temporibus ut cupiditate qui. Id minus aut consectetur unde consequuntur nobis. Ex aspernatur dolores quia enim ad et ab. Veniam ratione aut quibusdam. Quaerat et distinctio molestiae consequatur. Beatae veniam dolore consequatur voluptatem esse. Magni dignissimos id dicta deleniti soluta eum. Totam eum odit molestias exercitationem iure. Sit minus architecto molestiae veniam id error impedit. Officia cumque maiores provident qui sapiente ullam eaque consectetur. Quasi incidunt omnis id.",35629474.2,nisi,27,314,1970-11-19
et,1020,"Distinctio quia et ut iste quidem. Facilis eaque excepturi aut voluptas ut voluptatem voluptatem. Voluptatum sapiente architecto neque totam veritatis corrupti. Voluptas et ut recusandae deserunt sed sint dignissimos. Autem dignissimos perferendis laboriosam necessitatibus. Porro architecto voluptatem dolores modi id id. Quas veniam non sunt est corporis facilis. Optio autem quisquam ullam sit asperiores. Ex maxime veritatis aut et. Omnis ut dolores iusto et sed ullam distinctio. Est vero et dolores aut. Nesciunt repellat consequatur suscipit. Quae adipisci officiis consequatur odio sit corrupti. Sed omnis qui praesentium at. Eligendi eveniet et exercitationem commodi molestiae. Et voluptatem amet reiciendis delectus. Accusantium qui molestiae sapiente explicabo in dolores. Ullam dolor sit aperiam voluptas sed. Dolorum delectus ad eveniet earum dolorem. Quisquam alias minus recusandae est. Doloribus officiis nesciunt repellat est consectetur autem.",16439384.056844,qui,31,887,1988-11-10
dolores,1968,"Iusto non qui corporis laudantium sed quia. Exercitationem accusantium ut debitis dolorum a quia. Pariatur in nihil cum nesciunt et. Ut adipisci totam ut aspernatur voluptatem nemo. Omnis velit exercitationem illo iure quos suscipit. Nemo iusto ut incidunt dolorem qui itaque. Enim modi sed consectetur ipsum numquam quam. Sint sed sit maiores et vero itaque doloribus. Autem ut tempore iste quis cum. Sunt nostrum laudantium saepe maiores esse placeat. Aut unde magni ut quisquam beatae at et. Delectus est error facere ducimus quibusdam in natus. Optio ad repellendus expedita. Incidunt magni dolores dolorem voluptas nihil aut nobis. Unde blanditiis ut ut velit impedit occaecati dolore. Magnam eum sed corporis. Eos iusto dolores est animi id maxime voluptas. Blanditiis enim fugiat dolore a rerum aliquam eum velit. Quibusdam et iure voluptatibus modi et. Repudiandae optio veritatis ducimus eaque aliquid in est. Est fugit eveniet eius veritatis autem nesciunt aut.",1475.2,facere,24,374,1984-04-29
odit,4949,"Doloribus esse rerum et nisi maxime voluptatum omnis. Cum est dolorum et vel. Repellendus voluptatem sequi voluptatibus enim itaque qui et excepturi. Eius doloremque rerum iusto qui repudiandae. Vitae qui modi quis. Voluptates nemo laudantium dolor sunt nam. Architecto ea officiis corrupti. Quibusdam quo ipsa vel atque minus non aut. Labore in cum nostrum est quidem. Dolores est corporis velit aut debitis voluptatem eligendi. Molestiae repellat optio deserunt explicabo earum quam assumenda. Eligendi officiis rerum quas sit velit nulla. Veritatis ipsa nobis minus. Voluptatum quasi voluptatem earum veritatis in omnis eaque. Tempora maiores dolore blanditiis qui quos voluptatem labore. Aut id cumque aspernatur nulla incidunt possimus distinctio. Laborum et possimus et tempora dolorem maiores quas. Temporibus harum qui impedit. Dolore eos rerum repellat in. Nisi ex id quas soluta perferendis aliquid rerum.",24.2,adipisci,29,826,1985-12-01
ex,3493,"Eum animi animi fuga dolor inventore laboriosam. Dignissimos cum est qui nobis hic fuga provident. In mollitia minus sed voluptate. Natus aspernatur magni recusandae eum ut quo. Rerum qui autem et suscipit iure quod dolorem. Nihil dolores consequatur placeat enim odit. Ut quidem et ut molestiae. Ducimus qui accusantium sit voluptatem saepe. Provident et et alias nobis. Et est molestiae totam nihil dolores. Dolores qui laboriosam sint modi sapiente et. Aspernatur qui dolores delectus inventore odio quos facere necessitatibus. Odio iste ut architecto quisquam repellendus facilis. Nihil dolorum incidunt odit corrupti fugit eaque amet cum. Aut totam fugiat occaecati sed perferendis dolores. Perspiciatis ut nihil incidunt atque. Et velit sit est facere. Libero id et et suscipit architecto nisi consectetur. Quia fugiat natus velit suscipit veniam dolor reiciendis. Consequuntur reprehenderit voluptate temporibus non. Ipsam similique numquam qui laboriosam inventore sit ut.",2507.6898024,id,25,641,1987-07-08
