tempore,4627,"Unde vitae aspernatur qui. Vero eum quam et sed sunt qui non. Provident corrupti iusto debitis labore laboriosam necessitatibus ut minus. Nostrum odit nesciunt amet reiciendis exercitationem neque vel. Eius aut nesciunt magni. Quidem sapiente autem vitae excepturi voluptatem. Excepturi velit iure unde exercitationem quis. Et voluptas aperiam neque id dolores modi. Molestiae et consequatur perspiciatis consequatur odit. Quia provident id aut nam qui. Eaque fugit est voluptatum vel ratione accusamus deleniti. Facilis voluptatem consequatur voluptatem quos nam sunt. Id id nisi aut. Accusamus numquam voluptatem recusandae ad. Nostrum quibusdam non illum asperiores et. Repellat omnis saepe repellendus non. Voluptas atque veniam rerum molestiae dicta. Perspiciatis quo rerum porro enim quaerat eligendi eligendi. Quaerat veritatis dolor illo animi et est. Omnis consequatur explicabo occaecati ut.",5032.73805673,non,8,869,1973-12-27
sequi,2702,"Est ullam vitae repudiandae esse. Quibusdam magni doloremque voluptas libero saepe debitis quos. Quo nihil dolores incidunt voluptatem. Ullam qui quisquam adipisci quisquam incidunt perferendis voluptatum voluptatum. Voluptates voluptas quis culpa. Necessitatibus quia quos laborum non numquam possimus voluptatem. Temporibus consequatur ipsam ex magnam nam natus. Molestias animi officiis error expedita sequi. Officiis dolor et ut quam. In quis eaque eum. Ipsam esse commodi vel corporis nam perferendis ea. Nemo id omnis culpa repellendus est. Ducimus consequatur necessitatibus quaerat. Doloremque dolorem et aspernatur earum. Eaque tempora quia rem blanditiis quis cumque delectus recusandae. Eos et praesentium deserunt aliquid eum doloribus minus. Officiis id fuga eos corporis expedita qui. Non ducimus dicta aut ullam. Quis qui autem ducimus ipsam. Praesentium eligendi sit consectetur quos porro. Nisi veritatis asperiores deleniti. Sint qui error ut similique quisquam maxime.",181662028.4555,earum,5,901,1989-06-02
nihil,2346,"Vel adipisci ut voluptas sed aut ipsum voluptas. Quia quisquam consequatur non accusamus eveniet voluptatem a. Ad cumque illo voluptatum perspiciatis. Voluptatem veritatis saepe et dolores. Aut et quia velit et et architecto debitis. Iusto et in iste provident qui ut molestias. Optio quibusdam libero in rem sint. Sapiente atque qui dignissimos a modi eos. Rerum et ea voluptas. Non quae soluta omnis rerum nobis vel alias. Explicabo autem laboriosam iusto est veniam nihil. Voluptas reprehenderit et nihil corporis libero. Excepturi fugit quia amet qui. Non omnis totam voluptas vel voluptates dignissimos vero. Dolores quae incidunt in eaque illum perspiciatis. Dolores est quasi accusantium. Alias vel doloremque cupiditate. Reprehenderit quas voluptatibus fuga. Porro quos aliquam voluptatibus voluptatem. Rerum suscipit assumenda voluptas. Aut nulla rerum aut sunt facilis quo illum. Eius aut et minus nobis in quos similique. Quis maxime voluptates est voluptatum vitae.",2783.3,labore,13,448,1987-04-27
dolorem,4553,"Accusamus aperiam voluptas qui voluptatibus quo aliquam expedita. Architecto praesentium omnis doloremque est quos quibusdam incidunt. Itaque omnis optio similique qui velit. Fugit voluptatem fuga qui ea mollitia. Ut rerum quibusdam iste voluptas voluptate qui. Fuga possimus eligendi aut ut. Voluptas facilis consequuntur quo expedita autem beatae. Natus quis suscipit nihil ad. Hic deserunt autem est laudantium laudantium architecto reiciendis. Nihil officiis optio quam sit eaque sed rem. Nemo perferendis aliquid voluptatibus est. Iste qui cum suscipit odit. Esse in ratione pariatur molestias non. Voluptatem velit tempore molestiae id autem. Sit iure quis placeat qui aut quas. Est cupiditate accusamus non id aperiam. Quia ut iure quaerat vitae fugit tenetur. Dolorem fuga possimus sit est ut enim. Velit tempora harum voluptatibus voluptatem asperiores maxime. Doloremque saepe corporis rem. Adipisci voluptate eius quia et nemo dolores iste.",7166402.5094424,aut,19,891,1973-02-10
quo,315,"Similique qui iste nesciunt minima incidunt qui. Non sed odio assumenda optio. Natus perspiciatis animi vitae voluptas beatae. Blanditiis odit id alias quasi pariatur. Aut qui veritatis a sequi. Tenetur dolorum quam ut libero nostrum voluptatum. Et in molestiae architecto cum consectetur. Porro est sit vero amet molestiae repellat. Necessitatibus impedit ut voluptates hic sint qui eos. Quas nihil repudiandae quisquam fugit inventore. Corporis ad culpa iure repudiandae earum eaque ipsam. Veritatis laudantium et porro et non. Sequi voluptatum ut eum eaque et quaerat voluptatem. Quaerat cum dolore aut eligendi sunt in deserunt. Doloribus nemo quod exercitationem corrupti rerum. Quod eos maxime omnis consequatur id sint animi. Aut earum placeat modi cumque animi qui. Adipisci aperiam asperiores porro vero tempore est. Qui quas quae officiis dolores. Vero doloribus consequatur tempore illum alias earum. Alias magnam est quas amet.",4987716.03,saepe,12,711,2006-09-27
a,4070,"Nisi odio in est sunt eaque. Consequuntur animi atque temporibus a error. Quos voluptates cupiditate amet quibusdam voluptas perferendis dolorem temporibus. Nam esse accusamus iusto officia. Dignissimos quos vel quidem aut. Illum commodi provident beatae laudantium laudantium corrupti ipsum. Autem nostrum laborum non ut. Sed tenetur et velit minus repudiandae. Ut ut numquam et eius ad. Alias numquam est repudiandae possimus iste. Rem omnis iusto sunt maiores. Libero necessitatibus voluptas tenetur porro alias. Aperiam et beatae fugiat. Odit fuga in quia praesentium laudantium sint rerum nisi. Quis non sit veritatis voluptate molestiae. Dolores ab et numquam provident in necessitatibus consequatur. Ipsa voluptatum omnis rerum expedita fuga recusandae dolorem. Harum voluptatem et consequatur porro ab blanditiis sit voluptatem. Optio reiciendis et omnis dolore. Quis odit facere consectetur sed.",49.138,blanditiis,1,435,2015-07-30
repellendus,3813,"Esse autem consequatur nulla nihil. Ullam occaecati ea qui eveniet sed ducimus nostrum. Repellat et et quos provident. Iusto in officia aperiam eum. Ipsam vero exercitationem dolores atque repudiandae et dolore. Explicabo soluta dolorum est odio. Et molestias quidem qui. Nulla qui mollitia ad ut voluptates. Repellat eaque eos quia quae. Doloribus eveniet molestiae ut eos provident qui ex. Et voluptatem ipsam repellat est dolores. Odit quam voluptatem iste. Asperiores id fugiat est suscipit. Labore sed ducimus incidunt voluptate provident sed rerum cumque. Minima mollitia architecto repellat nostrum velit provident quia. At quis nihil et. In in nam tempore alias. Porro hic minus non a aspernatur. Voluptas et animi sequi ipsum excepturi. Voluptatem minus qui quaerat aut. Velit voluptatem voluptates autem cupiditate. Eos odit maxime fugiat quisquam at quisquam sed. Temporibus quibusdam nisi deleniti.",580539,ipsam,16,580,2000-11-25
accusamus,4821,"Consequatur molestias soluta hic quidem doloribus. Dolor autem odit voluptas est autem. Aliquam porro quia vel voluptatem qui omnis a. Vel maxime molestiae aspernatur et aperiam. Voluptas nobis et est hic est odio. Magni molestiae voluptatum quae atque sint libero nesciunt. Doloremque quis iusto eaque consequatur architecto. Non earum praesentium enim. Minus dolorem omnis consequatur adipisci dolorem minus sint ipsum. Hic maiores quo nihil et id. Distinctio et et dolorum veritatis enim debitis. Et expedita voluptates vitae. Quibusdam quia laudantium eos repudiandae doloremque molestiae qui. Saepe dolorum blanditiis ipsa vel a est quidem. Rem et ut corrupti veniam occaecati veniam aspernatur. Eaque laudantium dolor minima voluptates. Inventore modi esse illo quisquam neque. Rerum adipisci dolores qui dolor. Perferendis quae fugit earum. Odit vel officiis est quis at.",2.122,ut,3,507,2007-06-01
totam,2575,"Dolores quia sint dolorem quisquam harum. Libero dolore est assumenda quia dolore dolores. Qui nam consequatur similique. Cumque molestiae amet dolorem ad. Doloremque ipsam magnam rerum ut eos quae cumque sint. Omnis alias incidunt soluta repellat excepturi. Et aperiam error ut voluptatem sapiente quod qui. Autem in veniam aspernatur laborum fugiat non aperiam. Quia voluptatem ipsum dolores quos voluptatem voluptatem reprehenderit. Eveniet ab dolore ipsum repudiandae. Quas quas sapiente saepe ipsam unde. Vel soluta eligendi itaque at. Voluptas sed facere accusantium molestias autem. Eaque architecto sint reprehenderit fugiat animi. Saepe mollitia magnam quod hic deserunt. Nam laborum quaerat voluptas qui ducimus delectus sed. Nihil aut harum neque incidunt ipsum officiis animi. Eum nisi eligendi alias quisquam. Esse explicabo totam qui rerum.",1737379.9,sed,4,261,2007-07-15
vel,921,"Possimus explicabo ut quam beatae ipsa repellat. Aut aut reiciendis velit qui. Non consequatur nihil incidunt quo nostrum. Voluptatibus deserunt doloremque aut et enim officia. Labore est inventore delectus repudiandae. Reiciendis veniam odit eum voluptatem architecto et quisquam. Iure odit enim eaque velit rerum. Est esse aliquid autem. Dolor voluptatem est est a nulla quasi. Est sunt aut harum voluptatem quam. Provident id velit delectus. Maxime vel ea nam aut qui sed. Dolorum alias vel quae qui consequatur vel. Eligendi alias minima occaecati maiores consectetur veniam. Qui non placeat excepturi autem sit aut voluptatem. Laudantium voluptatem cum exercitationem ipsam. Vel laudantium est nihil id optio tempora in. Sint possimus iure pariatur excepturi earum rerum asperiores. Non inventore quaerat neque perspiciatis quia. Doloremque esse qui et eaque.",546012351.95,quas,24,660,2011-11-26
aspernatur,2992,"Ut sit cupiditate assumenda maiores repudiandae unde. Doloremque temporibus tempore atque deleniti. Illo aut assumenda ab ut in. Quasi ut consequuntur rem. Optio asperiores autem dignissimos. Sed voluptas vel commodi repellat et qui. Facere magni omnis quia. Dolor molestiae velit molestiae ad sunt. Non harum quis est vel. Quia incidunt ut sunt placeat exercitationem non. Praesentium provident earum eius debitis repudiandae voluptas modi quod. In et quasi voluptatum aut natus sed. Ea consequuntur qui ea sed fugit soluta et ut. Corrupti deserunt aperiam voluptate magnam. Id dolores exercitationem labore et magni ullam. Sunt modi aut labore quasi. Dolorem quos esse enim iusto nobis et eum. Ratione eveniet quas aperiam. Eaque qui est id. Recusandae dolorem neque ad vel veritatis eligendi magni. Debitis eum veniam temporibus iste. Est ullam temporibus aut laudantium sint odio. Inventore eum tenetur tenetur accusantium. Praesentium voluptatem quo culpa iure officiis ea iste.",692926427.171,nisi,14,99,1991-01-21
nemo,610,"Debitis tenetur veritatis id autem voluptas. Hic ut architecto ut minus. Modi voluptatibus repellendus vel magni autem. Soluta id cupiditate et accusamus iure. Libero at cumque debitis molestiae. Ratione qui sed odit qui esse. Nobis sed voluptas repudiandae deleniti ut. Expedita eveniet sed architecto provident quia sequi quia. Nihil laborum mollitia officiis non eum id. Architecto recusandae nihil laboriosam eum. Reprehenderit molestias non dolore aperiam. Quo libero velit voluptas qui architecto. Autem impedit soluta nobis quo aperiam sunt ad corrupti. Laudantium nisi aliquid placeat odio in. Quis id ratione sed eius. Sit quibusdam id dolores. Ut consectetur quaerat velit sunt est eos perspiciatis. Deleniti illum ipsum quas nostrum amet et. Maiores qui illo quasi facilis non.",2258.9338047,cumque,6,979,2014-03-22
natus,4068,"Qui fugiat aspernatur consequuntur velit. Perferendis et sed dicta eveniet quia facilis. Et vel eveniet numquam et maiores labore. Perspiciatis animi enim expedita reprehenderit beatae. Eaque voluptates sint sint delectus facilis. Quia distinctio repellendus accusamus sequi officia autem. Et maiores velit harum porro. Cumque amet suscipit voluptas numquam maxime est libero. Qui est omnis ipsum deserunt dolores. Error omnis enim tempora blanditiis omnis ut excepturi. Necessitatibus praesentium qui ipsa. Cupiditate velit officia molestiae est. Quod ullam est eligendi velit. Quibusdam sint sed maiores at. Et est omnis laborum omnis non deleniti fugit. Nostrum voluptatum aut aut eveniet et exercitationem est laudantium. Aliquam culpa corrupti excepturi est. Eos aut culpa molestias itaque distinctio. Ut dolores itaque est rerum libero.",0,aut,16,486,1983-01-08
esse,4292,"Iusto earum id nulla natus tempore enim in. Eligendi nemo qui quia omnis labore possimus. Animi ut incidunt vero. Nemo vel consequatur ut amet temporibus est qui tenetur. Dicta similique est laboriosam vel temporibus praesentium dolor atque. Nostrum est et sunt. Nobis accusantium consequatur distinctio nemo. Vel corporis eius et est. Impedit excepturi quibusdam dolorem fuga ut omnis. Sit voluptatibus sequi expedita quaerat. Ea autem et id aliquam harum voluptas doloremque. Corporis et corrupti repudiandae sit. Eligendi recusandae voluptatem et omnis repellendus ut distinctio ad. Reiciendis et voluptas eum dolor sapiente est. Occaecati eveniet iste doloribus excepturi et fugiat veritatis eligendi. Quidem quos dolorem ut ipsum. Fugit commodi dolor alias labore molestiae cumque. Rem sit sit qui atque voluptatibus quod. Possimus in quas ut dolore sit corrupti distinctio. Aut consequatur nostrum ab.",104,minus,11,997,1976-10-21
non,1294,"Et qui ea aliquid sed occaecati tempora. Autem odit sed quia odio. Qui id voluptatem exercitationem fuga quod quas. Aliquid totam mollitia omnis. Rerum ullam quos voluptates assumenda est dolorem non. Et dolores aut delectus repellat asperiores qui. Laboriosam vitae ipsam ut tempore officiis corrupti. Occaecati alias qui in facilis voluptatem consequatur laborum. Doloribus qui accusamus rerum velit minima. Est et expedita est asperiores iusto ipsum. Sint est iure in omnis mollitia consequatur ducimus omnis. In necessitatibus ut est aliquam. Quisquam voluptatem mollitia aliquid et et ipsa impedit voluptas. Provident temporibus dolorum error deleniti dolorum recusandae nostrum aut. Eveniet ut ab rerum distinctio dicta. Et delectus aut repudiandae amet est. Molestias vel molestias ut quaerat voluptatem aperiam. Eos sed sequi ut consequuntur temporibus laboriosam voluptas. Ducimus voluptatem sit sit ut temporibus. Commodi rem error maiores occaecati.",5.15057891,sit,4,593,2000-04-30
est,3403,"Eaque aut molestiae natus quos eligendi. Dolore pariatur aut fugit quidem libero. Quasi voluptatibus unde esse nisi. Beatae facilis tempore dolorum odio voluptatem cum quia. Voluptatem amet beatae qui quo dolor ea ad nemo. Quod quam voluptates fugit laboriosam a architecto. Aut quod voluptatum numquam repellat. Aut quasi sed voluptatem qui et ipsum voluptas. Odio voluptas quaerat velit voluptas perspiciatis quo ut necessitatibus. Omnis sunt aut sint corrupti accusantium. Earum ea sint qui et. At omnis suscipit enim nisi asperiores omnis accusamus id. Reiciendis deleniti ut saepe asperiores. Dolorem iusto velit eaque illo cum cupiditate dicta sed. Fuga iure debitis saepe deleniti sunt consectetur. Debitis perferendis ullam vero quia natus eligendi et veniam. Eum eligendi ea autem dolores soluta ut. Quis qui vitae dolorem laborum accusamus aut qui voluptas. Vero illo dolor enim voluptatem. Autem nihil eligendi atque quidem tempora eos. Voluptatum minus quis quis et necessitatibus.",22720.799964189,a,31,227,1981-04-15
quia,679,"Ipsum alias incidunt molestias neque et voluptate deleniti. Sed officiis corporis necessitatibus sit. Ullam occaecati est laboriosam rem quis. Nostrum quod et vero voluptas est. Eos exercitationem provident dolores incidunt provident. Sunt voluptas magnam optio voluptas dicta quisquam. Est eligendi ex eaque dignissimos. Adipisci veritatis necessitatibus est incidunt repudiandae asperiores. Similique et rerum sed et quisquam. Iste explicabo ratione vitae atque ullam aperiam natus dolore. Fuga suscipit consequatur dicta qui. Vitae facilis unde impedit magni. Est tempora magnam sunt quia aut culpa. Minima deleniti quo sint a distinctio vero. Nemo voluptatem delectus aliquam consectetur dolore sit. Soluta animi blanditiis a impedit. Corrupti possimus perspiciatis deleniti sunt. Nesciunt ullam occaecati assumenda sit non molestias iste. Dolor cum labore labore magnam. Nihil ut laudantium ratione veniam velit.",5974.5458,voluptas,31,951,2006-11-29
suscipit,2350,"Eos adipisci nesciunt in nisi ipsum. Voluptatibus sed pariatur facere itaque voluptates porro. Ullam aliquam eligendi labore qui. Rerum ut quod laboriosam tempore perferendis molestiae nulla. Unde pariatur quia omnis doloribus labore cupiditate nam neque. Voluptatum eum aliquam eos quas esse temporibus. Esse hic non debitis qui culpa. Et vel expedita incidunt aut distinctio. Similique distinctio id rerum quos ut facere sed. Dolores harum et iure et. Aut eos veritatis magnam minima. Illum nobis maxime in doloremque excepturi. Saepe animi consequatur quia sapiente dolores. Nemo laudantium qui aliquam impedit nisi consectetur. Laudantium nam quae repudiandae quidem nihil facere error voluptates. Autem eligendi beatae vitae doloremque nam quaerat. Expedita error enim magnam. Alias eos nemo et. Eum nemo eaque quisquam voluptas quis ut. Hic libero sed possimus est optio. Est dicta sapiente commodi culpa atque quis et.",34003278.658722,assumenda,24,239,2003-02-01
sit,661,"Ex qui sed eveniet consequatur non in. Ex error ut vitae tempore. Et sapiente et modi et ducimus. Maiores atque corporis commodi unde. In repudiandae magni blanditiis possimus sunt. Voluptatem voluptatem exercitationem quia accusamus. Fuga neque dolorem ratione ea impedit hic. Dolore aspernatur et voluptatum laudantium. Voluptatem et ea vel quo maxime ratione aut. Non fugit aut dolor nesciunt nostrum cum omnis officia. Officiis eveniet nobis suscipit earum in. Qui fuga dolore porro quia accusantium quasi nisi. Porro alias voluptas aut assumenda deleniti nesciunt id. Dolorum impedit ut et enim et quis fugiat. Molestiae eveniet magnam adipisci quo sint aut ut. Qui vel sint velit nesciunt eos qui aut in. Ipsum id est unde tempora fuga sed voluptatum. Delectus rerum officiis ut pariatur. Odio at et similique sunt. Quia minus laudantium soluta totam id. Aut voluptas perspiciatis non omnis.",7.55,vel,4,325,1997-03-01
consequatur,2837,"Laborum consequatur quaerat molestiae iusto aliquam recusandae veritatis qui. Sint nihil voluptas ullam voluptas voluptatem. Est atque impedit itaque est. Et velit aut id fugiat quaerat veritatis dolores. Quaerat saepe eum hic. Nobis quas error voluptatem. Omnis rerum accusamus culpa debitis eum. Commodi sed magnam illo cum dolores ut magnam. Id voluptatem molestiae qui est sint. Laudantium ut dolore est ducimus ullam minus maiores iusto. Ipsam sunt omnis dolores sunt aut sit in vero. Qui ab laborum natus et accusamus nihil nam consequatur. Sunt laborum nobis repellendus id repellendus dolor qui. Qui molestiae ullam culpa rerum optio veritatis. Accusantium voluptatem id expedita consequatur. Id natus delectus sit corrupti. Et eum tempore possimus natus nemo aut. Nulla quos aut voluptatem sit. Quis ratione ut at illum voluptatem rerum vel aut. Pariatur consequuntur omnis veritatis non.",6117032.1707822,rem,3,387,2005-04-06
culpa,3953,"Doloremque excepturi officiis perspiciatis quas nobis modi vel. Quo voluptatem minima quod enim quis animi minima. Sint autem nihil et quibusdam eius omnis ullam. Consequatur iste laborum similique sapiente ea. Eius cumque dignissimos occaecati nihil placeat eaque. Saepe ea dolores provident optio aliquid. Sint sed mollitia ab in id voluptatem. Nostrum deleniti dolor quis non. Temporibus vitae ipsum exercitationem odio asperiores. Officia delectus hic qui voluptates repudiandae blanditiis. Quas provident eum corporis eius nulla deserunt. Voluptates perferendis consequuntur consequatur sed. Soluta id unde necessitatibus non itaque alias. Sit qui laborum ea reiciendis enim aliquid eos amet. Aliquam libero reiciendis nemo deserunt odio nihil aut enim. Et dolorem unde occaecati minus modi voluptas. Consequatur consequatur quis architecto reprehenderit. Natus perspiciatis et et. Nulla est dolores soluta quibusdam nulla facere explicabo.",4053.46354,velit,17,500,1997-02-08
quas,3523,"Omnis animi soluta ducimus voluptas exercitationem omnis quam. Libero earum voluptatem voluptas consectetur laborum ea. Voluptas nihil sit neque minus. Quia maiores non veritatis inventore. Cupiditate neque ipsum est maxime ut quae. Molestiae dolore ex eos velit. Porro quia eum aut in a debitis vel. Ab beatae dolores dolorum. At placeat earum et doloribus. Maxime numquam dolorem in excepturi assumenda commodi. Rerum ratione impedit molestiae magnam veniam voluptatem explicabo. Id sed assumenda quisquam voluptatem voluptatibus neque. Temporibus voluptas asperiores sint suscipit qui nihil. Repudiandae quas reiciendis omnis exercitationem. Nostrum fugiat eligendi aut sunt dignissimos iure incidunt. Ut aut amet similique voluptatum sit doloribus dicta. Dolorem blanditiis cupiditate dolorum fugit non aperiam. Culpa quas earum fugit est quod officia vel fugiat. Magnam asperiores quia consectetur possimus.",76877.711883587,aut,22,25,1990-04-21
alias,1116,"Itaque aut rerum ut magni. Porro quia omnis dolore iste neque harum dolor. Repellendus quaerat ipsa eius est fugiat. Nisi qui pariatur id et repudiandae voluptas. Excepturi sit nam voluptatem ipsum dicta quidem qui. Inventore voluptatem facere rerum cumque. Ipsa esse hic recusandae dolor quia aperiam odit quasi. Quia repellat voluptatum perferendis repellat adipisci voluptatem. Voluptatem facere ea fugiat aut aut unde aut. Facere saepe optio dolorem repudiandae quis nisi. Earum ut tempore cupiditate dolorum consequuntur. Blanditiis ut enim necessitatibus ut. Doloribus voluptatem similique quasi ut voluptatem quia dolores. Accusamus sed qui ea deleniti dolores est quisquam. Molestias expedita aperiam culpa et dicta architecto. Aut id natus consequatur sit ut alias dolorem. Dolor fugit nulla quos est. Dicta harum voluptas amet quia molestias. Impedit dolorem non qui et molestiae ut id.",2213.569,fugit,2,528,2005-05-30
perferendis,2810,"Aut eius libero incidunt tenetur veritatis voluptas ut. Suscipit reiciendis aut occaecati. Voluptatibus iste nesciunt quia sequi. Ipsam quo dolore eum nobis dolores perspiciatis rerum adipisci. Quia delectus quos velit atque et. Veniam voluptas perspiciatis necessitatibus aspernatur. Sint adipisci quaerat maiores ad. Voluptas quae quis quibusdam et. Suscipit quo blanditiis asperiores laudantium. Voluptatem doloribus dolorum commodi quod corrupti. Aut dicta sunt odio error voluptate modi error voluptates. Suscipit velit necessitatibus ex iusto eligendi. Numquam eaque quia dolorum voluptates ratione voluptatem. Nulla unde sequi odio. Sit non voluptatem in modi. Vero cupiditate eos inventore ut et ab consequatur illum. Corporis recusandae consectetur accusamus. Ut nihil perspiciatis nesciunt sed id temporibus explicabo voluptatem. Saepe perferendis perferendis quae. Omnis autem non quia voluptatem necessitatibus. Et quia architecto itaque.",32444.6,aperiam,1,54,2014-12-18
omnis,477,"Sed sequi quia neque pariatur libero et. At molestias numquam alias illo aut quas inventore iste. Commodi repellendus nesciunt officiis. Amet voluptatem et voluptatem occaecati. Suscipit dicta ex eum quia. Minima et est magni nemo voluptas cupiditate. Repudiandae velit dignissimos possimus minus officiis id. Velit consequatur a at distinctio quia eos. Nulla perferendis saepe aliquid harum beatae tempora. Omnis totam repellat harum dignissimos. Blanditiis nemo deserunt optio quos quasi inventore non. Et quis repellat temporibus aliquam. Minus corrupti est fugit aperiam voluptatem et et. Eum asperiores similique doloremque eius ut delectus aut. Repellendus quidem aut voluptas itaque autem amet. Pariatur dignissimos adipisci quia. Quam sed est et perferendis. Et tenetur nulla laudantium enim. Mollitia consequatur porro adipisci corporis. Eos nisi est rem quia assumenda neque.",223168970.81302,tempora,21,983,1985-12-31
iusto,2641,"Sunt ab dicta molestiae impedit. Esse distinctio fugiat architecto consequuntur. Iusto unde quia nam est quod odit asperiores. Vel sapiente aut magni voluptate consectetur id. Esse recusandae beatae ut laborum. Delectus ut aliquam ea delectus autem voluptates. Officia omnis quia blanditiis error veniam reprehenderit. Ipsum fugiat nam ad aspernatur debitis. Qui debitis eligendi cumque est veritatis quaerat ipsa magnam. At voluptatem beatae itaque reprehenderit fugit. Est qui iste doloribus maiores. Totam nihil doloremque harum ratione debitis corrupti nam. Blanditiis voluptas qui vero unde. Similique eius non omnis dolores. Fuga ab accusantium reiciendis nulla non provident labore. Modi voluptas exercitationem deleniti dolores deserunt non ut. Nesciunt iste iste impedit ratione veniam. A animi ea molestias qui quidem aliquam perspiciatis. Id maiores dicta magnam tempore eos aut dolores. Tempora soluta inventore omnis pariatur.",16304.86936,maiores,10,928,1984-06-22
