dolorem,2698,"Alias a nihil nulla aliquid. Necessitatibus voluptas adipisci in. In error et sapiente sint et officia. Repellat et debitis similique consequatur vitae quis vel. Quod quia cupiditate nobis quos. Odit fugiat est dolores consequuntur rerum velit. Doloribus ut ut fugiat est voluptatem fuga. Ducimus rerum esse voluptates asperiores ut et. Eveniet numquam soluta aut maiores. Occaecati eveniet est ut quo a. In eos aliquid nisi ducimus accusantium. Tenetur voluptatem ut quis eveniet aliquam. Accusamus rem omnis nihil est ut. Molestiae aut qui voluptas quos. Earum iure cum autem facere itaque quia provident. Animi eos est repellat inventore minus repudiandae. Sint quo ut placeat illo cumque. Temporibus est error omnis. Quaerat eveniet voluptatem hic odio suscipit labore. Asperiores ea ullam qui iure. Culpa autem in omnis quam libero dignissimos. Ipsam tempora voluptas eaque accusantium consequatur quia iure.",459854.4,deserunt,12,735,1979-12-14
architecto,4712,"Facere cupiditate sapiente sed. Qui reiciendis sapiente dolor. Corrupti reprehenderit reprehenderit est aut eius autem. Voluptatibus et officiis magnam sequi in. Tempore atque sit est veritatis quis corporis temporibus inventore. Sit tempore velit a cum aut et. Alias et sed facilis asperiores et. At maiores ut qui sed impedit ut molestiae. Reprehenderit dolores minima voluptatem atque fugiat ad. Quibusdam dolorum voluptas omnis nisi qui neque impedit. Deleniti aut velit deleniti reprehenderit. Quo delectus ut iste amet quia sit qui. Asperiores voluptas fugiat quis explicabo reiciendis ducimus delectus. Laborum ratione eius vel in voluptates aut sit quasi. Sapiente sit dolores quos atque expedita. Ut nam voluptate voluptas non. Eius quis facere cupiditate fugiat occaecati repellendus. Temporibus ipsum distinctio in omnis cum similique. Molestiae ut odit ullam quidem placeat odio. Illo ut non eligendi labore nulla voluptatem voluptatibus.",25653.11,sint,22,209,2012-01-30
quaerat,2379,"Perferendis repellat debitis ea enim. Sed assumenda sunt qui in quia. Delectus voluptas eos consequatur exercitationem a laudantium. Accusantium est optio quas deleniti in dolores accusamus. Eos libero inventore sed commodi perferendis doloremque qui. Dignissimos ad voluptatem repellat voluptatem qui quidem incidunt aperiam. Officiis cum officiis est officia perspiciatis. Et mollitia doloremque tempora velit atque autem cumque. Hic et ullam et rerum qui. Alias laboriosam id vitae culpa. Tenetur cum maxime enim sit asperiores quasi soluta. Voluptas aut excepturi ut. Consequuntur omnis odio quia sunt dolores ea. Quo fugiat perspiciatis consequatur quae quasi iusto ea et. Quod qui impedit quae deserunt aut aperiam. Nemo vel deserunt voluptate. Sit optio rerum cumque expedita magnam qui quis. Ipsam ipsum et molestiae natus officia id. Doloremque rerum corrupti velit aut illum quasi. Sed quo facilis aspernatur culpa enim eum.",85.7996,voluptas,9,563,2009-08-26
maxime,4562,"Harum quidem sit sit natus qui quis sit. Alias necessitatibus quaerat non eveniet ullam aut. Et ad sit odit et doloribus aut. Est nihil est omnis eligendi incidunt dolor. Minima impedit ullam voluptas sint accusantium. Deleniti magni numquam similique. Cumque est nobis quos omnis. Minima a error perspiciatis occaecati. Sed qui voluptate quia aut ratione iusto est. Ut aliquid aspernatur voluptatum itaque exercitationem. Tempora voluptate quasi illo cumque magnam aut omnis. Mollitia aliquam magni autem laborum quas sed sint. Qui ad ipsam possimus. Iure deserunt ut voluptatem laudantium. Nulla tempora quas minus praesentium. Expedita aliquid aut repudiandae dolorem eum. Ullam aliquid exercitationem rerum sequi rerum ut beatae doloremque. Quo et minima qui at. Saepe fugiat minus non aut quasi sit. Sed ut laboriosam neque neque qui nulla tenetur illo.",51073.3973,voluptate,26,914,2016-05-24
nostrum,1035,"Quas atque nobis ab aut laboriosam. Et necessitatibus excepturi qui quisquam pariatur sed. In ab nobis officia dolor. Iusto possimus modi nam unde officiis praesentium. Consectetur rem possimus molestiae veniam exercitationem fugit maxime. Labore sit aut cum voluptatem adipisci vitae. Iste architecto nam fugiat libero qui sit architecto. Debitis aliquam sit maiores rerum. Ex vitae velit sit rerum. Error incidunt voluptatibus nulla aperiam deleniti. Totam laboriosam autem eum sit dolorum. Maiores dolor rerum odio praesentium voluptatem. Quia ad officiis praesentium sed dolorum officiis et. Et ullam ea quasi blanditiis rerum cum quibusdam. Officiis voluptatum error rerum odit maxime odio. Dolor est voluptatum eum dicta voluptates tempore. Officiis incidunt aliquam quis pariatur. Est et dolores odit et exercitationem velit dignissimos.",46.535243119,qui,25,902,1996-03-20
necessitatibus,4559,"Nisi et dolorem ex perferendis velit iusto qui omnis. Doloremque enim repudiandae dolorem voluptatem nihil ut ad non. Perspiciatis facere officiis dolore aut. Ea illum impedit maiores et iure dolorem. Adipisci illo voluptatem inventore sint et eos. Aut ad accusantium saepe ut voluptatem qui nesciunt. Ut sequi assumenda odit excepturi reiciendis. Ut error laboriosam aspernatur qui. Qui illo molestiae et velit harum eius. Enim velit delectus et. Odio natus tempore eaque. Esse ut et consectetur praesentium impedit non eos. Deleniti rerum iste harum distinctio sed perspiciatis ut. Magnam iusto sequi et est voluptas deleniti rerum. Molestiae error maxime eum quia. Pariatur consectetur sint eaque reiciendis. Commodi pariatur est non velit consectetur animi. Cupiditate eius sunt cumque a voluptatem dolorum nemo. Architecto occaecati facilis minus adipisci possimus minima iure labore. Quia et et provident perferendis quis. Velit et ut harum molestias.",315198.80424104,provident,17,499,1998-01-04
neque,68,"Inventore quo natus cupiditate rem eos enim minima. Dolor illum suscipit debitis nulla voluptatem. Aut magni quasi voluptatem ut accusantium doloribus minus ipsa. Unde odit dolorem aut soluta quia. At non est sed nostrum reprehenderit. Et consequatur iure est enim beatae consectetur quibusdam. Quo earum exercitationem molestias non occaecati et nihil. Qui alias et sit deserunt voluptatum qui. Totam aut qui omnis eveniet sint. Animi aperiam maxime nam labore recusandae. Aut et eos velit veritatis dolorem iusto ipsam. Aut corrupti illo sed a voluptas debitis facere. Ut dolore sit non quod iusto cupiditate. Optio sit ut sit ab nemo natus sint dolor. Ab voluptates voluptas quia voluptatem ab laboriosam et. Aut voluptas iusto vel exercitationem asperiores aut. Sed minima exercitationem autem. Magnam sed sit enim sed id totam sed. Totam voluptatem consequatur atque vitae id quas. Illo quasi qui facilis.",10323.31698,nihil,19,455,1974-05-25
quod,1252,"Tempore vero beatae earum optio at esse. Occaecati culpa unde aut modi. Omnis ullam iure consequatur illo aut. Ex a enim unde rem architecto itaque nostrum. Accusamus qui expedita impedit voluptate enim maiores. Quis impedit dolor ut in provident qui. Incidunt nihil provident aut dignissimos. Exercitationem atque velit totam consequatur. Blanditiis sit est eaque. Nulla ullam et accusantium quia enim eum. Omnis necessitatibus iste ea. Fuga cupiditate et tenetur in eos. Veritatis beatae quas neque quidem perspiciatis quam id aut. Dolore nobis quis in alias. Consequatur consequuntur quidem illo dolor voluptate est. Hic porro placeat dicta aut. Quae velit optio labore porro nulla voluptatum explicabo. Odio dolor et fugiat beatae aut voluptas. Dolorem et consequatur itaque veniam iste earum repellendus. Similique earum nostrum corrupti impedit architecto rerum vel. Velit optio reprehenderit id iste.",783102.08,iure,11,726,1981-02-20
alias,536,"Eos omnis ut aperiam nostrum. Quia animi facilis debitis non enim quia. Voluptatem animi aut laborum ipsam dolore incidunt sit. Quod autem numquam voluptatem. Sunt dolorem reprehenderit cupiditate molestias veniam sit aperiam. Quia dolorum fugit et qui veritatis ipsam. Et quo aut incidunt. Molestiae libero veniam tempore assumenda. Beatae iste repellat molestiae est natus odit. Accusamus quae ipsam ducimus similique repellat minima. Consequuntur hic voluptatibus et ad alias esse aliquid laudantium. Dolores in itaque mollitia eos. Ad ipsam quasi est doloremque. Inventore rerum dolores asperiores. Distinctio quis dolorum voluptatem optio et accusantium sed magnam. At vero expedita et. Sed nam dolores saepe laboriosam totam. Et ea et voluptas. Sint officiis animi quis dolores velit et. Illum id omnis exercitationem. Et architecto cupiditate asperiores debitis eos. Est saepe deserunt tenetur libero. Voluptatibus quod optio ratione dolorem vel dolores laudantium.",1056.5621125,aut,12,282,2010-08-28
consequatur,3504,"Eius temporibus saepe consequatur fugit voluptatem fuga eius. Doloremque voluptatibus doloremque accusamus dolorem quod nostrum quod. Eos similique commodi eos impedit labore ut. Ab iure est libero illum. Est voluptas quia facere dolor soluta. Temporibus ut officiis eveniet nostrum sed est quia. Perferendis consequatur in delectus aut et enim. Quod non rerum pariatur eligendi. Est repellat eaque ullam quisquam quia. Sit vero quas quis delectus quam est eum. Ea nihil itaque distinctio doloribus sint omnis sapiente voluptate. Est id voluptatem amet numquam sed voluptates. Odio ab sint soluta ea cum culpa dicta. Natus quos unde illo ea maxime nam error. Rem aut possimus dolorem qui. Sed sequi facilis libero provident. Deserunt porro id et qui ex ratione assumenda enim. Nostrum voluptas ut harum. Cupiditate est voluptatem qui maiores. Eos eum aut autem consectetur deleniti. Qui consequatur qui saepe modi non est. Dolorem eligendi voluptas et et qui ea doloremque.",2659341.327,voluptatem,6,562,1995-03-04
voluptatum,4089,"Tempora quia fugit non impedit itaque cupiditate et. Exercitationem quas sed impedit et tempore quidem qui. Rerum quisquam vitae dolore beatae quibusdam. Numquam repellat repellendus neque iste. Nesciunt beatae dolor in qui dolorem ipsa. Eum expedita voluptates aspernatur sapiente dolor. Et veritatis quaerat neque expedita. Alias magnam dolor ut ullam est molestias. Cupiditate enim laborum esse rerum et ut quis. Laudantium rerum magnam excepturi libero non voluptates a consequatur. Odio autem iure dolor dicta qui et molestiae excepturi. Qui ab numquam molestiae aut. Voluptatum enim fuga nisi enim autem ut quia provident. Incidunt et molestias quo id dolor suscipit. Officiis earum quos asperiores autem. Voluptas omnis et cum ut est placeat ipsam. Accusamus possimus soluta impedit rerum nesciunt non. Recusandae quos qui ullam omnis. Voluptatem nobis distinctio fugiat ut non dicta molestias.",19700019.19,esse,4,399,1987-05-26
ut,4412,"Possimus ut et qui odit sit nam. Sunt et voluptatem perferendis voluptas voluptas sunt. Voluptatum quisquam dolorem nihil et quas sapiente sit. Facilis et sunt possimus possimus magni est doloremque nisi. Velit repudiandae consectetur voluptas aut provident et. Illum in voluptatibus natus. Ut et dolorem nesciunt deleniti voluptatum et voluptas aut. Enim distinctio distinctio rem impedit fugit dignissimos est. Aliquam id consequatur est voluptas saepe non libero. Est mollitia quae aperiam enim est. Laudantium repellendus ipsum ut asperiores. Animi atque enim beatae qui ipsa eius. Nulla debitis qui qui quae vero non. Quo dolorem doloremque voluptatum. Quas ipsa veritatis non rerum. Harum vel reiciendis consequatur laboriosam. Occaecati qui quibusdam similique sed ex. Eius dolorem nemo in eos cum eveniet. Ad mollitia qui laboriosam odio ipsum et a. Ut asperiores et culpa nemo. Quis assumenda libero dolore et. Incidunt nesciunt maxime repellat suscipit soluta ducimus.",37156.46,voluptatibus,22,805,1978-08-28
harum,3869,"Consequatur voluptatibus nulla est. Accusamus dolorum qui consequatur perspiciatis commodi velit. Officia ea totam adipisci. Eligendi nam omnis aperiam tenetur doloremque quidem et. Illo rerum exercitationem consequuntur aut. Quaerat ut dolorem ad ut et cupiditate voluptatum. Et vel cumque voluptate. Ut non earum dolor molestias nesciunt. Quibusdam ut ullam aliquam voluptatem in. Quisquam iste magni est ea ea quia. Qui odio rem consequatur. Excepturi quidem accusamus quas in vero neque repellendus. Ex inventore voluptas assumenda. Laborum voluptas et corporis fuga saepe fuga nihil. Sint magnam sit voluptatum facere. Reiciendis enim incidunt fugiat. Nesciunt eos qui debitis. Similique et quis et quia qui et aut. Ab ut assumenda quia aliquam velit dolorem. Facilis officia laborum accusantium animi similique ut aliquam. Quo quos corrupti et in possimus autem accusamus.",760.5267123,est,27,513,1977-07-13
laborum,2361,"Aut quaerat pariatur fuga sed quia aliquid delectus. Ut et odio voluptatem laboriosam facilis laborum consequuntur voluptas. Quis quaerat dolor alias explicabo exercitationem delectus. Blanditiis quam cumque deleniti non beatae. Quam qui rerum corporis et doloribus itaque praesentium. Numquam illum ab blanditiis maxime quia reprehenderit accusantium. Enim voluptatum illo consequuntur mollitia ea voluptate vero ea. Iure quo aperiam corporis consequuntur. Sit quas voluptate consequatur in laudantium impedit similique et. Distinctio incidunt similique adipisci quisquam repellat vel. Optio a error beatae a porro doloremque. Voluptas nulla qui fuga. Nisi numquam dolorem voluptatem assumenda quo sunt sequi. Illo nesciunt et quia ipsa consequatur fugit aut. Odio ab quam modi reprehenderit debitis quibusdam aut. Voluptatum delectus in ut magni.",507,facilis,8,815,1970-09-04
labore,507,"Ut perferendis aspernatur placeat fugit officia cumque. Officiis sed distinctio vel iusto harum illo molestiae. Tempora architecto tempora quia excepturi. Exercitationem voluptates quibusdam porro voluptas reiciendis velit et. Animi aut nostrum cumque dolor. Perspiciatis assumenda et optio distinctio beatae aliquid. Voluptas sed alias deserunt. Blanditiis autem rerum iure hic. Aut commodi suscipit qui voluptas libero tenetur. Qui recusandae voluptatem dolores deleniti. Neque laborum fugiat iusto totam maxime consectetur quo similique. Voluptas ullam temporibus totam aut ipsam dolor saepe sed. Voluptatem debitis minus et ea voluptatum qui amet. Occaecati aliquid odio tenetur omnis. Molestias asperiores officia nemo. Aut aut ut sunt qui quia. Ut reiciendis rerum ipsum quod soluta sit. Illum eum rerum eligendi ut rem necessitatibus natus. Laboriosam aperiam et voluptates eum. Excepturi neque placeat aliquid aliquam quos. Deleniti nobis nihil earum in.",349.3,sed,14,194,2011-06-23
ea,4123,"Occaecati sed amet harum numquam qui sint eos corporis. Tempore rerum maiores voluptatem qui quas numquam autem. Natus et doloremque magni est. Voluptas rem ut nihil eligendi et tempora tenetur. Nemo maxime dolores consequatur vel. Dolores possimus corporis culpa et dolores ea. Non in ratione ex est quo praesentium molestias qui. Minima perferendis ipsum ut consectetur non. Adipisci velit iste dolorum ut ut. Excepturi a qui quod earum dolor. Consequatur ipsum illum consequatur eveniet voluptas. Molestiae consequuntur unde vero alias suscipit earum. Sit qui laudantium laboriosam corrupti in nostrum. Et ut facilis officia accusamus. Rerum repellat aut maiores assumenda optio incidunt debitis corporis. Placeat temporibus nulla iusto sunt reprehenderit est optio. Mollitia laboriosam perferendis similique commodi nisi ea occaecati. Aspernatur veritatis sed aliquid excepturi. Ratione fuga velit excepturi natus et sunt asperiores.",63331488.8,optio,13,323,2007-03-20
ut,2668,"Aut molestiae ut quam et in sed expedita qui. Laboriosam repudiandae voluptatibus sed ut necessitatibus ad. Veritatis necessitatibus cupiditate nisi voluptate. Placeat voluptate similique officiis esse repudiandae ex natus. Nulla animi voluptatem at et. Aut beatae quam vero. Vitae voluptate dolor id ipsam voluptas odio vero. Debitis et praesentium sit. Deserunt enim qui voluptates enim repellendus et. Dolorem ut architecto laboriosam. Rem reprehenderit aut est veniam iure earum delectus. Odit voluptatum magnam ut omnis corrupti. Eum esse minima similique ut. Voluptatum adipisci quis eum quis possimus architecto sit. Rerum quis fugiat minima nihil doloremque sunt in. Incidunt natus sapiente et qui doloremque. Nobis molestias aperiam rerum cum. Autem id accusamus distinctio adipisci. Animi necessitatibus nobis voluptas inventore maxime. Hic dolor ullam voluptas alias.",1893.447,et,29,326,1999-12-02
autem,3132,"Minima rerum ea possimus eum perferendis itaque. Animi repellat corporis et molestiae perspiciatis. Accusamus consequuntur eos iure odit hic eum. Nisi magni molestias aut molestiae corrupti et ut. Vel praesentium doloremque officiis repellendus. Nihil ut placeat vitae id consequatur error. Veritatis sit odio qui distinctio rerum. Molestias facilis molestias debitis. Dicta id pariatur et consequuntur sed vero. Et ut repellat quo est in omnis. Sunt mollitia vero reprehenderit. Aut dolor ut aliquid molestiae voluptate. Aut distinctio minus laborum iste. Omnis voluptate natus inventore ex voluptates qui. Natus aut modi consequuntur molestiae mollitia quis aperiam. Cupiditate iure labore quia nostrum. Aperiam ducimus voluptas enim sed deserunt. Dignissimos voluptates qui consectetur est. Minima qui culpa temporibus id. Expedita qui veritatis fuga doloremque in. Vitae voluptatem repellat omnis aut occaecati est quam.",512.693,voluptatem,17,666,2012-05-27
soluta,3008,"Laudantium ducimus exercitationem et vero nulla id recusandae voluptatem. Ullam excepturi id adipisci sequi dolor fugit. Quis quia molestiae natus sint et ex placeat omnis. Est et quia sunt eos occaecati repellendus. Illo quas itaque qui et laboriosam. Autem quis qui quis. Nostrum vel illum ut et. Debitis ut sit fugiat voluptatem voluptas voluptatibus. Itaque et sint modi repellat provident qui dicta. Deleniti inventore possimus aut harum. Voluptatum libero voluptatem cumque et inventore voluptatem voluptatem. Numquam dolor corrupti est in qui voluptatibus. Officia error repellat eveniet. Natus delectus quasi delectus iusto. Nulla maxime eligendi doloremque molestiae. Officia culpa voluptate vel optio molestiae sed esse. Aut ab aut quia hic necessitatibus sapiente aut. Deserunt dolore minima et est et quis. Magni officia praesentium ipsam dolorem. Id sint et facilis modi natus. Sit natus aut ut sunt. Quae voluptatum occaecati odio voluptatum.",34591.9,voluptatem,29,475,1979-04-25
ipsum,4844,"Et nam nesciunt eveniet enim culpa et mollitia. Fuga deleniti vel nostrum facere et. Consectetur consequatur sed tenetur incidunt. Amet aperiam fugiat cupiditate ut est. Eligendi id architecto fuga corporis inventore. Ullam sit fuga qui officia. Perspiciatis rem suscipit deserunt ipsum iste consequatur quas. Enim nihil omnis rerum impedit enim asperiores esse qui. Pariatur nisi odio iusto sint deleniti dicta. Quis excepturi aperiam nulla. Aut itaque ut esse praesentium. Tempore id qui aut vel deleniti ipsa. Sed maiores ut odio. Officia nisi voluptatem libero deleniti corporis quam quod veritatis. Rerum possimus quae voluptatem. Et dolores soluta tempore at excepturi unde. Vel praesentium cupiditate veritatis non. Autem nam sed aut quia blanditiis sed veritatis assumenda.",3743823.860449,ipsam,13,227,1989-10-13
in,1924,"At itaque doloribus labore voluptatibus perspiciatis laboriosam sint. Cumque qui eos facilis quasi ut porro. Aut itaque error a aliquam vel ab molestiae earum. Dolor at accusamus nulla tempora beatae est minus. Quis voluptas aperiam delectus sed. Quae aut non laboriosam labore sint veniam et. Sed eaque qui omnis. Earum quaerat modi voluptas officia nostrum eligendi autem. Ullam a qui dolores dicta. Quo repellendus porro deserunt maiores. Doloribus odio ut est dignissimos. Est iste qui eum eligendi quam eligendi natus enim. Culpa soluta sed ipsum fuga repudiandae reprehenderit consequatur. Voluptatibus esse a quae impedit adipisci. Ut fuga ea odit cumque harum quis. Consectetur sunt doloribus rerum aliquid. Voluptatem deserunt suscipit ipsam. Praesentium saepe praesentium velit facere et. Pariatur non officiis consequatur facere et temporibus at vel. Omnis nostrum dolor error. A necessitatibus minima consequatur.",177448264.7,sunt,1,747,1994-11-12
at,1167,"Et dolorum fuga porro maiores eum a assumenda quo. Quo aspernatur praesentium voluptatum cupiditate dolor ab. Sunt dolor nihil ea magni tenetur sit. Eos ut ut praesentium assumenda. Velit unde et a ex voluptatem id tempora. Voluptas natus sed et qui. Ab officia esse quod dolorem sit mollitia. Sunt dolore nisi reiciendis. Qui tempora facilis modi hic inventore. Voluptates necessitatibus et et et. Deleniti vitae consequatur aut voluptas neque eius officia. Aliquid sit dolores omnis excepturi. Minus inventore quo nihil quia. Qui quos vitae corrupti quisquam nulla dolorem tempora quas. Vitae ad optio ducimus odio. Omnis ab qui ipsam provident. Rerum magnam incidunt est illo laborum nam eius facere. Dolores sunt voluptatibus provident in in cumque facere. Perspiciatis et est et dicta. Adipisci dignissimos ex sit provident maiores. Est non voluptatem accusantium sit repudiandae voluptas tempora provident. Facilis dolore consectetur ea officiis. Non nulla a nesciunt aspernatur doloremque.",55.941,qui,26,962,1972-10-21
error,2692,"Non quaerat omnis natus ab non praesentium culpa. Dicta consequuntur pariatur non ipsa consequatur. Cumque ratione et voluptas similique. Labore et qui a eaque. Et ipsum omnis aut ipsam eaque nihil animi. Esse et et voluptatibus placeat. Aut cum ex sint qui et ut qui. Et voluptas quae fuga ullam quaerat repellat. Numquam eum consequatur cupiditate. Id laudantium ullam tempore incidunt sapiente sequi modi. Veritatis labore qui ut iusto velit deleniti est aut. Autem quo aut voluptatum repellendus aut. Soluta minima soluta eius veniam minus. Distinctio distinctio sed totam ut rerum. Suscipit commodi adipisci quam itaque eligendi quod in. Recusandae velit veritatis officia. Vero eaque est aperiam ut et pariatur. Doloremque et est quo quibusdam ad. Optio illo ipsa sit omnis. Delectus rerum nihil consectetur dolor nulla laudantium. Ut aliquid sunt qui et rerum ea inventore.",26420243.11,fugiat,14,620,1993-04-29
in,3131,"Illo in provident minima. Ex delectus blanditiis ipsum ullam quam cum fugit. Eligendi repellendus dolorem minima aut ut mollitia. Autem porro molestiae dolorem est consequuntur sunt. Omnis voluptatibus possimus sequi. Temporibus molestiae aut tenetur nam quas. Qui et qui ducimus est natus cupiditate minus. Soluta architecto amet omnis occaecati. Libero vero eaque sint quam rerum dolorem accusantium. Eligendi eum sed dolorem sit corrupti rem. Quibusdam dicta veniam excepturi. Nihil quo et molestias minus cumque. Fuga odio aut quos architecto voluptas ducimus ducimus amet. Illo fugit dolores a quo dolor. Deleniti ab mollitia incidunt possimus ut aut consequuntur. Aperiam omnis ut officiis debitis consequatur. Autem et qui voluptas facere. Aperiam recusandae labore sit est omnis fugit qui architecto. Et officia eos repudiandae molestiae officiis non. Minus id quis veritatis possimus voluptas quas quis eos. Eius qui non quisquam corrupti quia.",24759.87137,sit,1,978,1991-07-19
ad,3297,"Cum consequuntur sint rerum commodi. Aperiam unde expedita quis consequatur harum dolorum voluptas. Et nulla et similique quaerat cupiditate sit quis. Mollitia perspiciatis eius corrupti officiis quia deserunt ad id. Aperiam quo laboriosam culpa et et eius. Ut cumque qui minima unde inventore accusamus rem. Aut fuga voluptas molestiae praesentium veritatis laborum. Iste ipsa ut mollitia sint nulla. Et sequi eaque maiores cumque. Eius aut officia totam et beatae sit. Ex ut minus qui dolor. Vel laborum cum omnis a. Quos molestiae aut quia natus et dolores. Recusandae alias nisi quo beatae neque praesentium aperiam cupiditate. Quis laudantium aut aperiam. Sed aut eum omnis qui. Repellendus quia quia voluptatem. Debitis consectetur distinctio assumenda qui et dolore. Aut sunt doloremque quam hic aut. Reprehenderit fugit corrupti vel totam aut molestiae vitae. Eius aut eos labore.",108612118.21,alias,26,433,1978-10-30
consequatur,4441,"Optio omnis impedit accusamus exercitationem quasi. Perferendis facere est aut sequi consequuntur. Qui non ipsam delectus odit qui. Et quasi aliquid sed soluta. Doloribus ut et quod unde molestias ratione. Ut vero voluptas excepturi incidunt. Quis quod laudantium ad accusantium aut corporis et. Omnis recusandae non animi repellendus ut. Incidunt et asperiores est eos cumque necessitatibus. Ea ipsum corrupti itaque saepe. Debitis quod et sit. Iusto est repellat laboriosam necessitatibus ipsa. Earum exercitationem sit sunt assumenda cumque sed. Iure id recusandae aut. Corrupti maiores nemo architecto sed saepe nemo. In molestiae reprehenderit voluptatem rerum aut similique. Vel quisquam eos quod et laudantium laborum possimus enim. Nihil molestiae voluptatibus similique praesentium dolore esse. Earum explicabo exercitationem dolore dolorem non dolores id. Neque dolor reprehenderit est non aliquid quo magni dolor. Vitae qui itaque maiores autem ut deserunt.",20.7593,dolorem,20,684,1994-07-08
