at,1712,"Eveniet aut labore et magni nulla. Velit cumque eius molestiae voluptatum exercitationem non. Occaecati est aut culpa aspernatur. Aut omnis assumenda id minus doloribus. Et ut quis labore reprehenderit consequuntur et ratione. Ratione quasi accusantium voluptatem consequatur. Pariatur assumenda enim eum eum officia tempore aliquid. Enim similique et est dolore quisquam. Consequuntur quo aliquam rerum laboriosam consequatur. Asperiores deleniti non iste dolor praesentium et. Quisquam possimus quo enim sint est. Qui cupiditate iure mollitia corrupti voluptas nihil doloremque. Sint laboriosam dolor et earum aut illo debitis. Reprehenderit placeat voluptatem doloremque. Nulla ipsa repellendus dolores cum voluptatibus. Explicabo eum explicabo delectus sunt. Ut quasi qui a in minima veritatis in.",1520.814059,blanditiis,24,80,1974-10-30
accusantium,1376,"Et et tempore non cumque assumenda quia et. Facere ipsam ea sint voluptatem. Nihil inventore qui in sed est aut. Vel aperiam molestiae molestias eum quae nihil. Incidunt dolores modi reiciendis enim dignissimos exercitationem. Dolorum pariatur numquam eum nulla aliquid nostrum nihil. Magni sunt pariatur quis facere sequi sint eius impedit. Et recusandae doloremque sit sint voluptatem repellendus est. Quaerat et et et ut dicta dignissimos. Harum amet porro accusantium similique id quasi. Nisi ex repellat aperiam molestiae qui est natus. In id qui deleniti at odit ut numquam. Quasi et voluptatem voluptas debitis nemo distinctio. Nihil velit magnam occaecati ut omnis. Harum architecto et enim sapiente. Adipisci ut quae sit iste id dolorum. Velit illum dicta alias id esse quia aliquid. Quis modi id assumenda perspiciatis doloremque et dignissimos. Occaecati quos a unde quam ducimus.",23,quam,24,654,2017-05-23
quidem,1803,"Iusto et id ut sint delectus sunt ex modi. Magni nesciunt nam consequatur ipsa repellat aut. Officia eveniet fugiat aut optio. Quia aut dolores dolores quae eligendi beatae animi consequatur. Qui et sed rerum. Aut praesentium id dolore et sint culpa ut. Molestiae ab minus animi. Corporis et nam est omnis ipsa rerum. Recusandae est nihil illum sequi nesciunt. Impedit ab illum in enim. Repudiandae blanditiis itaque et ratione cupiditate. Esse iure sed vero voluptatem. Maxime voluptate quasi omnis sunt nihil quo atque autem. Quis dolor ipsam rerum omnis quas et. Consequatur non nam tempora error doloremque. Consequatur voluptatem non eveniet doloribus ut. Aperiam culpa recusandae eos consequuntur explicabo officia. Eius soluta eius id debitis. Et sit et architecto numquam natus mollitia et. Voluptatibus nisi harum aut et facilis adipisci non est. Vel aut voluptas ut cum quas soluta aut minima. Id est fugiat vel occaecati qui. Ut eos eaque harum.",4.0586103,voluptatem,24,490,2000-03-07
eos,565,"Cum debitis laborum praesentium sed cum ab totam. Modi maiores tempore aperiam vel nihil dignissimos minima. Accusantium odio inventore quia quisquam odio aut accusamus. Aut et sint amet sunt quia vel. Quasi dolores dolorem quidem in sed veniam excepturi. In perferendis est quod. Molestias dolorem nulla dicta sunt. Quasi tempora odit consequatur natus neque dolores. Odio numquam accusantium est deserunt ullam laborum. Cumque cupiditate iste nulla nobis ut molestiae. Nisi voluptatibus unde facere reprehenderit. Ea sint eum neque tempore sed. Ut ipsam est temporibus qui doloribus rem consequatur qui. Cum est eos officiis vitae aut. Adipisci provident ipsa dolor fugiat. Laudantium cumque et et odio qui nesciunt beatae. Odit incidunt id corrupti quas. Earum sint magni qui dolores consequatur impedit. Consectetur nesciunt inventore qui repellat cum deleniti nostrum non. Eos architecto sit aut adipisci voluptatem ullam doloribus ipsum.",42458.2870058,dolore,30,843,1983-04-04
aliquid,4709,"Optio dolor et ut provident alias deleniti. Atque est illum et aut error. Aliquid iure aspernatur qui facere maiores. Ea reprehenderit dignissimos voluptatem quis. Consequatur ipsum perspiciatis minus et expedita sit quasi. Voluptatibus nostrum eligendi repudiandae velit reprehenderit saepe. Veritatis ipsam minima reiciendis explicabo. Aliquam non vel officiis blanditiis nemo odio quo. Incidunt minima est dignissimos praesentium accusamus quae ipsam et. Sint voluptas qui rerum enim nisi ut. Atque nesciunt ipsam repellendus dignissimos corrupti quod corrupti. Culpa voluptas fugit cumque excepturi eum sed. Delectus dignissimos omnis officia error nihil facere ullam error. Illo ipsum aliquam quas aliquid. Voluptatem earum sed aut est. Quis architecto odit harum quia explicabo. Qui eos sequi sint laboriosam reprehenderit et. Eveniet laudantium autem sunt explicabo. Magnam in molestias itaque veniam id.",5796.196334207,cupiditate,3,915,1994-12-03
eos,2583,"Harum praesentium nam vel repellat. Est illo exercitationem placeat doloribus deleniti. Voluptas magni ea est expedita delectus. Voluptate ipsam debitis quos veritatis hic porro. Eligendi dolor itaque error repudiandae excepturi cupiditate vero. Natus fugit officiis qui voluptate ab est ad. Repellat rerum et quas eum cum qui. Qui aspernatur reiciendis qui corrupti. Ad quia aliquam necessitatibus vero magnam provident culpa. Voluptatem quo ut rerum. Dicta eius recusandae ipsum beatae maxime labore omnis. Sunt autem architecto nemo dicta. Voluptates debitis culpa adipisci aut eos rerum voluptates. Adipisci deserunt accusantium recusandae et aut et doloremque necessitatibus. Sapiente a vel assumenda qui provident autem. Cupiditate corporis molestiae voluptatem sed itaque. Atque inventore officiis velit blanditiis dolor officia. Eligendi officiis amet eius.",396.680093663,nihil,10,478,1991-11-01
consequatur,3494,"Omnis dolorem ad iure et dicta sint est. Ex hic sit a. Aut dolorem officia quidem quia porro. Necessitatibus nobis autem odio et. Ipsum et dolorum ut aut alias dolorem recusandae. Sed rerum et ut nihil molestiae eligendi. Saepe quibusdam dolor aut odit ex iste est. Nesciunt fugit laborum nesciunt sunt. Dolorem eligendi dolor eos beatae et asperiores. Ipsum blanditiis blanditiis recusandae ut. Veritatis et qui ducimus et eaque vero. Iure repellendus iure rerum amet ea quod ea tempore. Iusto aut qui ut libero. Totam aut dolor nobis minima quod reiciendis consequatur. Vero adipisci voluptas voluptate praesentium sint qui id. Libero eveniet qui praesentium deleniti quia. Maxime placeat esse natus voluptas pariatur. Consequatur quia ipsam modi et voluptatem impedit. Beatae animi dolor dolores.",22286.2,dolor,31,314,2015-03-31
voluptates,194,"Quia non sit qui itaque harum expedita. Ut doloremque tempora suscipit eligendi. Ab dolorum quae cumque perspiciatis. Maxime doloribus placeat possimus laudantium hic qui doloribus a. Alias illo aut illo pariatur iste earum. Asperiores deserunt blanditiis laudantium quibusdam veritatis inventore occaecati. Voluptate non et ipsum qui. Saepe dolorem saepe dolor voluptatum deleniti iusto. Commodi voluptate exercitationem saepe ut unde dolorem ut. Similique eos aut blanditiis. Alias odit nam error voluptatem impedit quia consequuntur non. Praesentium aperiam at laboriosam quia consectetur a repellat. Fugit sit accusamus qui alias. Rerum at mollitia voluptatem aut veniam totam unde. Fugiat soluta quisquam voluptatem ut atque vero. Aliquid vero corrupti quaerat consequuntur adipisci. Ex ipsa non et. Blanditiis facere mollitia eius blanditiis non quia. Quaerat cupiditate velit officiis minima quaerat et at. Totam eos quidem minima sequi voluptas.",56537525.663598,in,27,952,1999-01-15
omnis,3975,"Veniam repellendus ut quis ipsam consequatur labore enim voluptatem. Eum voluptatibus quae et qui omnis et. Laudantium aspernatur maiores mollitia sint deserunt nostrum. Dolor quod quo ratione consequuntur debitis molestiae. Aperiam aspernatur autem accusantium excepturi quidem. Voluptate dolor eum dignissimos aliquam assumenda. Est dicta aut temporibus. Ad voluptas aut impedit sint molestias. Dolorem delectus sed alias adipisci nihil. Officiis quod illum ea officia fugit velit. Asperiores earum quasi et ad rem excepturi aut ut. Facere perferendis ut aliquam eum veniam illum incidunt architecto. Incidunt recusandae fugit ut placeat inventore pariatur laboriosam. Fugiat voluptates sit voluptate est atque sed impedit fugiat. Autem voluptate dignissimos sed repellat at. Quia aperiam dolor ullam ut sed voluptatem. Eius nemo et enim sit velit est dolorem accusamus. Impedit et ut eos ut ad. Aut quidem nemo eaque sed qui unde sequi. Aut fuga impedit ut non.",2252,aut,26,404,1989-04-07
quaerat,3073,"Fuga voluptatum vel reprehenderit. Illum nostrum ratione incidunt quod autem aut. Vero totam repellendus et aut quas id aut. Maxime porro saepe laudantium facilis qui. Nostrum quia earum voluptatibus explicabo distinctio ea. Asperiores quia cumque laborum et quibusdam voluptas alias libero. Praesentium similique eaque sed velit praesentium. Enim optio molestiae maxime quo iusto sunt vel. Voluptatem ut recusandae sint culpa. Eveniet et enim a distinctio iste. Ut qui nulla quia aut eaque hic. Nostrum dolor adipisci eius. Nam eveniet rerum eveniet. Suscipit officia voluptatum laboriosam voluptatum impedit. Modi et aut a quasi doloribus vel architecto. Itaque dolorum molestiae laborum rerum iste vitae. Tempore vitae error saepe qui. Vitae qui autem id atque quisquam qui et. Rerum ullam enim cumque. Qui excepturi eos ipsa enim eius voluptatem. Eligendi voluptatum laboriosam odit voluptates officiis.",2177372.9947629,quod,5,374,2003-12-06
quo,1646,"Sed et repudiandae voluptas pariatur asperiores impedit officia. Ut eaque corporis rerum et magnam et. Eaque esse sit quisquam esse maiores quasi pariatur. Dolor eaque hic ipsa excepturi est in. Consequuntur sint pariatur exercitationem quo. Facere qui voluptas ipsa neque sed voluptas. Vero porro eveniet harum pariatur. Commodi occaecati nostrum corporis eius tempora et. Non quasi dignissimos animi debitis maiores totam corporis facere. Sed esse itaque quae sit qui aut. Praesentium sit facilis doloribus voluptates modi. Ut debitis eos voluptatem dicta blanditiis. Sint tempore dolor voluptas tempore sunt. Explicabo recusandae et impedit perspiciatis voluptas. Et enim minus molestias cumque distinctio doloremque repudiandae. Suscipit consectetur quis ad voluptatem in provident. Dolores impedit voluptatem aliquid voluptatem et. Quia dolor dolorem id nisi. Doloribus et iste ea at aliquid. Libero deleniti nemo accusantium dolore perspiciatis adipisci animi.",6265847,beatae,18,194,2011-11-10
soluta,1582,"Rerum quis quia in suscipit nesciunt. Accusamus accusantium nihil vitae tenetur et. Doloribus consectetur voluptas quas reprehenderit. Suscipit enim eos error. Atque quam aspernatur ipsa distinctio illum minima odit. Voluptas molestias doloremque facere rerum et. Qui libero unde repellendus rerum nemo suscipit. Distinctio amet mollitia omnis qui omnis quos. Unde doloribus fugiat explicabo saepe molestias temporibus. Quia cupiditate fugit blanditiis ut qui. Quibusdam libero ab voluptas qui rerum inventore ea. At quasi aperiam et dolor et. Omnis voluptate voluptatibus impedit. Ab ratione natus suscipit voluptatum praesentium rerum. Est dolores amet dolore blanditiis magni consequatur. Sit facilis porro aut maiores. Ut nam non ut velit delectus voluptatum architecto. Et similique nobis minus est blanditiis adipisci dolore. Aut totam velit accusamus quidem et eos ea aperiam.",6.6,aliquam,22,309,1993-07-03
aliquam,731,"Aliquid sequi eveniet nulla ullam reiciendis. Maiores aliquid tenetur id voluptatum voluptas. Suscipit expedita ab consequatur nihil id numquam est eaque. Omnis quo aut commodi voluptate laboriosam minus. Vel voluptatum libero praesentium esse aut sed adipisci. Enim corrupti dolore reprehenderit eaque molestiae omnis. Sit atque accusamus ut veritatis a aspernatur molestiae. Ullam aut et blanditiis qui neque perspiciatis nihil et. Ducimus illum nostrum magnam possimus. Sunt aut voluptatem ab qui sed in reiciendis enim. Veritatis sit est ipsam deleniti suscipit voluptatem dicta rem. Earum illo fugit autem cum. Qui expedita molestias consequuntur vitae esse omnis. Repudiandae vero beatae est omnis consequatur magni. Consequatur a dolorum autem necessitatibus. Sint quia qui aut voluptate aut nesciunt. Consequatur doloremque laborum libero nesciunt aut. Et repellat totam ut.",4.35592,sunt,7,707,1971-03-19
consequatur,3143,"Aliquid mollitia voluptatem magnam et. Quibusdam sit odit ipsa voluptates dicta asperiores aliquam. Sit amet eaque praesentium totam ullam. Doloribus eos dolores voluptates est. Voluptas non non non. At placeat repellendus nobis in nihil incidunt quidem. Et deserunt a consectetur omnis. Quia consequuntur a quod consequatur ab omnis nobis. Ut voluptatem delectus sit sit quo molestiae. Eveniet dolores itaque quasi id dicta occaecati. Distinctio facilis ad vitae praesentium eveniet. Quam quod voluptatum autem. Dicta ad autem quia officia ipsum dolores illo. Aut iusto rerum exercitationem pariatur ipsa consequatur. Quis officiis unde et laborum eum est. Dolor et enim magni velit. Dolores nam earum consequatur at. Sed expedita mollitia non. Magnam ipsam molestias quod fugit. In in vitae quia est voluptas quae libero. Sit qui animi voluptatem ut architecto aspernatur. Soluta autem odit in voluptates rerum facilis minus.",44263904.234454,quae,29,846,2000-03-25
ut,342,"Ut dolores accusantium fuga aut voluptatem quis enim sint. Deserunt aliquid doloremque et accusamus perferendis ut cum ut. Occaecati nihil adipisci nihil ea eum. Molestiae ut beatae voluptatibus expedita velit eum facilis quam. Vel quo perferendis eos quia ut sed ut repellendus. Architecto odit nisi minima dolorem. Voluptatem hic quod aliquid ut omnis eaque in dolorem. Mollitia earum esse et necessitatibus iusto aut. Voluptatem nihil rerum tenetur aut molestias qui fugiat. Occaecati qui labore impedit amet iure. Quasi voluptatibus soluta ea est. Omnis hic animi reprehenderit eaque. Praesentium cupiditate amet nesciunt nesciunt doloribus deleniti consequatur. Unde quia tempora distinctio error est. Odio reiciendis saepe qui sed sit. Odio nihil provident ducimus aut. Possimus iure velit eligendi deleniti sed ipsum magnam. Consectetur a velit mollitia aperiam et necessitatibus. Est sint vero quod eligendi aut laudantium porro nam. Quaerat sit error assumenda.",157.33,molestiae,27,488,1986-07-24
dolorum,2602,"Aut et itaque optio. Dicta et ullam velit sed qui ut. Tenetur nihil eum et eligendi dicta assumenda nemo. Amet doloribus voluptatem impedit aspernatur non et expedita. Nostrum beatae et consequatur ut quae nihil voluptate incidunt. Labore voluptate odio ab non hic. Nam velit corrupti numquam ipsa molestiae vel. Et illo incidunt ut voluptatibus est. Labore explicabo dolorem ut unde voluptas repellat corrupti aliquid. Dolores est amet error tenetur et accusamus. Saepe quibusdam mollitia aut ut rerum sed. Architecto est dolores et eum. Architecto numquam voluptatibus in ipsam temporibus. Placeat non tempore et delectus vel adipisci. Commodi architecto perferendis nostrum libero adipisci itaque voluptatem. Magni animi vel ut excepturi. Pariatur non suscipit accusamus occaecati. Et fuga voluptates inventore aut iusto et sint. Cupiditate earum sint quod eligendi. Earum inventore optio qui earum minus.",160601244.7117,voluptas,4,229,1988-08-08
cumque,4835,"Et distinctio in ut sint quos. Fugiat repellat blanditiis veritatis id dignissimos fugit provident. Non illum quia qui qui. Dolore reiciendis voluptas quaerat. Asperiores sequi labore provident eveniet est. Sit facilis dignissimos accusamus amet rerum itaque. Doloremque dignissimos quos fuga. Optio ea repellat aut et. Sint et sit quia reprehenderit. Id fuga neque magni fugiat velit omnis. Veritatis et provident ullam laborum. Libero aut sint adipisci nulla. Sed deleniti pariatur voluptatem et autem facere minima. Dignissimos aspernatur totam ratione. Ut velit maiores totam molestiae. Excepturi dolor aliquid rem sit ipsam exercitationem. Hic sed quae qui velit aperiam laudantium natus. Et id non placeat aut optio repellendus molestiae nostrum. Recusandae enim officia voluptas. Odit perferendis voluptate est consequatur incidunt. Inventore deserunt aut modi eius sequi est corrupti. Et qui est tempora soluta ipsum. Quod et aspernatur sed a.",167023236.43719,vero,13,392,2015-08-31
molestiae,2835,"Velit in aut voluptatem praesentium nam id. Labore reprehenderit saepe velit quidem. Fuga rerum sit est qui explicabo enim. Est est accusantium aut et ut deleniti. Veritatis ut nihil doloremque quas molestiae non fugit. Aspernatur numquam aspernatur et quis aut omnis. Consectetur facilis voluptate esse voluptatibus. Molestias ducimus aut harum vitae quas delectus. Dolore sit quas consequuntur odit quia facilis iusto. Mollitia nemo numquam iusto molestias corrupti illo minima. Cumque provident cum neque facere natus. Rerum voluptatem nihil similique quia expedita quae aliquam. Veritatis accusantium asperiores dolores alias praesentium. Aliquid voluptatem illum natus dolores. Laudantium doloremque omnis culpa enim sed nulla. Accusantium in eum minus pariatur voluptas. Animi molestiae ipsum voluptas rem. Est dolorum odit commodi dolores. Sed quam architecto sint sed at. Quas et fugit earum. Explicabo illum nemo est commodi. Magni est iste ipsa aspernatur velit repellendus est.",48942.5612085,voluptatem,21,73,2016-06-22
et,1560,"Quis quae nostrum molestiae et ullam ratione. Nobis placeat fugit id nulla. Accusantium repellendus molestiae et nam non voluptatem. Esse aperiam eum incidunt adipisci illo. Eum at ut ex. Quasi libero velit tempore et beatae adipisci omnis. Et facere quos quam doloribus perspiciatis. At dolorem inventore quasi aut eum fugiat. Aut repellat dolorem consequuntur voluptatem quae doloremque maiores. Sit omnis aut ab ducimus quos doloremque. Natus non soluta quaerat quasi amet. Distinctio aut ipsa accusantium autem ex rerum. Quia ex nemo totam est. Eum magnam autem sint occaecati cupiditate molestias. Est qui eum nostrum earum. Rerum distinctio odio est sapiente ex veniam placeat. Deleniti ut sit provident aut reiciendis cupiditate. Dolore blanditiis esse qui rerum sapiente veniam at voluptates. Saepe enim fugit laboriosam facere sint eum nulla. Et aut optio quibusdam ipsam est corrupti et. Quam voluptatibus quis eos doloribus et eveniet.",299.604743,pariatur,29,249,1994-10-03
itaque,370,"Labore aperiam quisquam tempore temporibus deleniti. Sapiente rem repudiandae cumque aliquam. Voluptas non adipisci harum occaecati dolores natus. Odio voluptatem eius natus sed. Explicabo dignissimos dignissimos in fuga labore sint ducimus. Porro atque quibusdam necessitatibus molestiae non et. Qui non fugit iusto ipsum odit atque nam deleniti. Libero est et rerum est alias ex. Molestias quam tempora quia magnam. Ea placeat tenetur voluptas sed facere. Vitae qui alias quia. Omnis mollitia quaerat sit molestiae ut est. Autem voluptatem aliquam quos voluptatem nobis molestiae. Qui dolore qui exercitationem voluptas tempora temporibus. Ut quaerat nihil quia voluptatem at. Occaecati officia dolor ipsa est nobis quae porro. Occaecati ipsa officia dignissimos facere. Praesentium quam esse inventore voluptas distinctio. Nobis qui aut deleniti iusto quaerat. Suscipit tempore iusto alias aliquid repudiandae alias.",2654059.1831029,deserunt,6,721,2016-04-23
iusto,4406,"Natus numquam dolores earum non rerum. Corrupti est in porro et ut. Est dolore temporibus repellendus suscipit quod. Odit iusto pariatur enim fugit expedita qui optio nihil. Eligendi voluptatibus ea laudantium beatae consequatur autem laudantium. Voluptate praesentium est est delectus dolorem. Ipsum ducimus odio et est. Corrupti ullam recusandae iste tempora. Magni fugit exercitationem ut. Quo minima quaerat reprehenderit quasi dolorum. Ex molestiae perferendis tempora ad sit consequatur dolore. Dolore fugiat ut esse quaerat. Qui id quo possimus repellat autem quis vero. Est sed eum eaque aut placeat blanditiis. Voluptatem quia delectus iusto cupiditate modi omnis. Dolor fuga neque qui beatae necessitatibus possimus. Sunt quia doloribus saepe ut quisquam quos aspernatur. Porro consequatur hic maiores architecto labore voluptatem. Fugit et omnis porro quae ea aspernatur. Error aperiam nostrum sunt. Non praesentium ut ex deleniti voluptate.",33.09,minima,1,927,1990-09-22
reprehenderit,4096,"Doloremque delectus iusto aliquam quis voluptas ut perspiciatis nesciunt. Enim qui veritatis eum reiciendis. Cum quia qui vel quia qui nam voluptatum. Aperiam corrupti culpa quibusdam illo esse et eum similique. Quia assumenda veritatis sit pariatur illo atque id repellat. Voluptas dignissimos est qui. Dignissimos ipsam praesentium facilis non hic. Cupiditate expedita cumque deleniti dolorem porro consequatur ut rerum. Qui temporibus tempora laudantium architecto aspernatur rerum aliquid. Blanditiis nihil magni earum magni. Debitis eum repellat veniam aut iste voluptatum. Consequatur quidem consectetur aliquam molestias numquam. Optio rerum et rerum non praesentium id. Incidunt explicabo reiciendis vero aliquid numquam. Est et ut facere optio ut eum pariatur. Repellendus qui ut odio aut molestiae. Inventore sunt eveniet iusto. Omnis quia sit provident id dolor quae itaque.",84577.73,velit,4,722,1975-02-19
reprehenderit,367,"Enim provident ut ut assumenda accusantium enim. Quisquam quis voluptatem qui nesciunt voluptas quo tempore. Iusto dolorem quasi quae accusantium autem sequi. Minima quaerat alias autem eaque. Reprehenderit explicabo corrupti tempore dignissimos saepe nostrum delectus. Fugit omnis earum ut veritatis voluptatum debitis beatae. Magnam sed quia quia facere. Eius et ipsam corporis et dicta. Et ipsam ipsam consequatur ipsum rerum exercitationem. Quam commodi non in ex suscipit in. Aut deleniti aut aliquid quo optio rerum sit. Soluta officiis rem aspernatur sed ducimus culpa atque provident. Rerum molestias voluptatem omnis dignissimos nihil. Culpa dolorum maiores ducimus molestias mollitia eum aut. Provident tempora dolores dolores neque quis sit est. Tempora et consequatur neque harum suscipit nisi molestiae. Magni voluptate eos omnis quia voluptatum. Atque et commodi saepe est vero qui. Maiores rerum voluptatum illo. Eius cupiditate nesciunt qui et voluptatibus amet est.",354029771.856,dolorum,10,726,2003-04-09
suscipit,1432,"Rerum deserunt ducimus odio doloribus. Aut sed culpa ut. Rerum nihil pariatur optio sit ducimus ipsa consequatur. Omnis non placeat est aut suscipit tenetur laudantium. Assumenda fugit aut quas repellat distinctio. Iste ex dolorem facere ratione exercitationem. Facere minus rerum omnis nihil non. Ut occaecati reprehenderit rerum molestiae ut aut doloribus delectus. Voluptas blanditiis eligendi at dolorem quia ipsum dolor. Adipisci ad amet nobis sit. Aut aliquid reiciendis omnis et. Provident ipsum eveniet et provident itaque. Odit et autem expedita est id. Consequatur voluptatem omnis rerum ex qui sed cupiditate repellendus. Dolor est sed expedita rerum aut libero qui. At eos quia aut consequuntur voluptatibus et. Voluptates qui deserunt quidem. Tenetur quaerat praesentium accusamus quo illum sit. Dolorem ullam sed ut voluptatum impedit et eaque deleniti. Non iste dicta explicabo commodi ratione sed quo.",20.9797,voluptas,17,937,1977-05-28
et,4620,"Distinctio nisi distinctio amet nostrum. Laboriosam qui sit ut mollitia sed soluta quam est. Delectus iusto quasi eveniet inventore. Enim natus similique temporibus. Magnam aut reiciendis libero. Explicabo harum sint placeat dicta ipsam qui iure. Voluptatem et consectetur quibusdam dolorem maiores velit eum qui. Rerum sint reprehenderit et cumque. Illum eos pariatur ea non omnis et ea. Veritatis ea laudantium sapiente ut voluptas. Et laborum animi animi et voluptas ipsa. Facilis aut aperiam tempore asperiores quis architecto magni. Quia hic odio et aperiam. Aut aliquid fuga voluptatem quod. Suscipit minima et placeat enim. Veniam vel voluptatem nam voluptas iure. Consequuntur perspiciatis eveniet sit aut laborum reprehenderit quia rerum. Recusandae ullam sed dolor vero aut laborum sint. Saepe amet nobis quae aut nemo similique. At adipisci voluptate dolor mollitia quo explicabo.",1121266.2,non,23,522,2001-10-10
vel,3915,"Nihil impedit ad ullam saepe ad magnam aut sit. Maiores sint ipsum ratione et eum corrupti. Ea fugit ex cum laborum amet nobis. Aperiam consequuntur dolorem deleniti tempore voluptatem aut. Quos magnam exercitationem dolores aut architecto ut deserunt. Omnis voluptate dolorem possimus eius eos quos explicabo aut. Deserunt nemo dolores ex quidem rerum et. Eius maxime incidunt iure corrupti. Quo modi neque voluptate sed ut minima. Et aut exercitationem sit eveniet iste. Id beatae nemo nesciunt harum asperiores et distinctio. Quae beatae officiis quam iure minus et eum. Beatae est et est atque dolorem deleniti tenetur. Ut dolores perspiciatis deleniti qui temporibus officia. Aut recusandae aut minus rem dolores possimus voluptatum. At dolores quasi nemo soluta qui autem. Velit tenetur accusamus repellat.",10596,consequatur,4,165,2011-11-14
